rating,date,skinType,skinTone,skinTrouble,repurchase,content
"5","2024.12.29","복합성","여름쿨톤","잡티, 미백","False","장벽이 약하고 예민하고 염즈응성 트러블이 자주 나서 무조건 쓰고 있어요. 개인적으로 너무 잘 맞아요.
진정에도 좋고 건조함도 확 잡아주고, 각질완화 피부트러블도 좀 줄어드는것 같은 느낌. 예전보다 발림성 좋아져서 더 좋아요."
"5","2024.12.12","민감성","여름쿨톤","잡티","False","라로슈포제 시카플라스트밤 B5+
너무 잘 쓰고 좋아서
큰걸로 시켰는데 대용량이라
아주 가성비 있고 만족합니다~!
정착템입니다 ㅎㅎ"
"5","2024.11.23","복합성","여름쿨톤","잡티, 미백","False","피부 각질 이르고 따갑고 예민할때 무조건 써요.
제형이 되직한데 발림은 가벼워요.
건조함도 없고 피부를 보호해주는 느낌이라 나이트스킨케어 필수템이에요."
"5","2024.10.25","복합성","겨울쿨톤","잡티, 각질","False","피부트러블이 올라오면 꼭 저녁에 수면팩처럼 꼭 바르고 자는 아이템!! 절대 지켜~~😍"
"5","2024.09.28","복합성","봄웜톤","잡티, 블랙헤드","False","발림성이 되게 꾸덕한데 그만큼 장벽개선에 도윰이 되어서 나이트 루틴에 쓰는중이에요"
"5","2024.09.23","복합성","웜톤","잡티, 모공","False","라로슈포제 시카플라스트는 밤제형이라 사용감은 살짝 무거운 편이에요. 지성피부를 위해서 젤형태가 나왔으면 좋을것 같습니다. 진정 보습에 좋아서 사용하고 있고요, 살짝 번들거려서 저녁에 주로 사용하고 있습니다."
"5","2024.09.17","복합성","여름쿨톤","잡티, 미백","False","백탁같이 들뜨는 거 거의 없이 흡수도 빠르고 보습감 너무 좋아서 속건조 심한데 확 잡아주고, 답답한 느낌 없어요. 
피부가 민감해지다 못해 아프다 싶을때 무조건 쓰고 있어요."
"5","2024.09.07","복합성","겨울쿨톤","잡티, 각질","False","100ml. 사용해보고 너무 좋아 큰 사이즈로 구매했습니다!
특히 트러블 났을때 수면팩느낌으로 바르고 자면 그 다음날 거의 진정이 되어 떨어지지 않게 쟁여놓는 템입니다!"
"4","2024.08.30","약건성","쿨톤","미백, 주름","False","피부 뒤집어질랑말랑할때 마지막 크림으로 써요
건성인데. 생각보다 무겁지않아요~ 
편하게 매일 발라도 괜찮은! 크림이라 생각해요 ㅋ"
"5","2024.08.28","건성","봄웜톤","잡티, 미백","False","시카밤 조하요!여름에는 굳이 필요 없긴한것 같아요
겨울에 꾸준히 쓰려규요!!"
"5","2024.08.18","복합성","쿨톤","잡티, 미백","False","피부과 관리 받고 재생크림 바르려고 구매했어요. 더마 크림 중 유명한 건 거의 다 써봤는데 이게 젤 좋았어요"
"5","2024.06.30","건성","봄웜톤","잡티, 미백","False","보습도 잘되고 썬크림처럼 백탄 현상있어서 저는 좋아용 ㅎㅎ"
"5","2024.06.30","복합성","쿨톤","각질, 트러블","False","보통 재생크림처럼 하얗게 발리는 제품이에요. 제형자체가 꾸덕하지는 않고 약간 묽은 느낌이라 발림성은 나쁘지 않습니다. 데일리로 낮에 바르는건 진짜 극극건성 아니면 비추천이고 나이트케어로 바르시는걸 추천드려요!"
"5","2024.06.30","민감성","쿨톤","블랙헤드","False","자극 없이 순하고 피부 트러블 진정에
딱인 거 같아요!
콕 찍어서 발라 놓으면 딱인거 같아요 ㅎㅎ"
"5","2024.06.29","민감성","겨울쿨톤","트러블","False","라로슈포제 라인은 토너를 포함해서 꾸준하게 사용중입니다! 써보시면 알아요..꼭 사세요"
"5","2024.06.10","복합성","봄웜톤","트러블, 피지과다","False","쿠팡에서 직구로 사다가 가품이 너무 많다는 말에 올리브영에서 구매했고 이제서야 안심이 됩니다. 라로슈포제 꾸준히 쓰고 있는 제품이고 항상 만족하고 있습니다."
"5","2024.06.05","","","","False","피부 상태 안좋을때 잔뜩 올리고 자면 좋아요 진정효과 많이 봤습니다!"
"5","2024.05.27","중성","쿨톤","잡티, 미백","False","재생원탑♡
피부과 다니면서 효과본 제품!
3통넘게 사용중!
밤타입은 흡수하는데 오래걸리지만~
효과가 더좋음!"
"5","2024.05.25","","","","False","피부 뒤집어진거같을때.. 스킨케어 귀찮을때.. 이거 하나만 바르고자면 괜찮아요b 발효성분 안맞는분 외엔 두루두루 다 쓰기 좋은 크림이라고 생각합니다! 밀리고 백탁 심한 제형이라 자기전에만 쓰는 제품이에요"
"4","2024.05.17","민감성","봄웜톤","트러블","False","보습감 좋고 민감한 피부에도 사용하기 좋아서 추천해요!!"
"5","2024.04.28","민감성","가을웜톤","트러블","False","지금 접ㅊ성피ㅂ염갖고잇는데 
이거바르면 가려움이랑 건조함 없애줘요 
진짜 굿.. 
리뉴얼전보다 훨조아졋네요 사길잘해따"
"5","2024.04.23","민감성","쿨톤","블랙헤드","False","더 써봐야 알겠지만 지금까지는
무난무난하게 쓰고 있어요!
흡수가 더딘 것 외에는 쓸만한 것 같아요!!ㅎㅎ"
"5","2024.04.21","건성","여름쿨톤","잡티, 트러블","False","시카플라스트 시리즈 너무 효과 좋은데 가격이 너무 비싸요ㅠㅠ 이거 진짜 ㅅ보습력 재생력 둘 다 너무 좋은데 가격 할인 많이 들어갔음 좋겠어요"
"5","2024.04.12","복합성","여름쿨톤","피지과다, 모공","False","오늘드림으로 시켜서 엄청 빨리 왔던 기억이 있네요! 올 겨울 무난히 사용했던 데일리템"
"5","2024.04.08","민감성","쿨톤","잡티, 미백","False","꾸덕꾸덕하지만 열감진정과 보습 최강 재생크림❤️
오랜시간 인기있는 이유가 있습니다.
환절기나 건조한 날씨에 수면팩처럼 사용하고 있어요."
"5","2024.03.31","복합성","쿨톤","잡티, 주름","False","최고진짜 없어지면 안됩니다 계속 팔아줘요 이거 쓰고 피부 많이조아짐!"
"5","2024.03.24","복합성","웜톤","잡티, 미백","False","바르고 다니면 피부가 좋아서 자는 사용하고 있어요.
다쓰면 또 살거에요"
"5","2024.03.03","민감성","봄웜톤","","False","피부가 민감할 때 사용하기 좋을만큼 순한걸로 유명해서 구매했어요. 보습과 진정효과를 기대하고 있습니다."
"5","2024.03.01","복합성","쿨톤","잡티, 주름","False","자기전에 꼭 바르는 크림인데 이불맡에 두고 바르면 너무 좋아서 잘쓰고있어요"
"5","2024.02.28","복합성","웜톤","미백, 각질","False","사용하고나면 피부가 좋아지는 느낌이 들어서 자주 사용해요"
"5","2024.02.25","민감성","여름쿨톤","각질, 트러블","False","데일리로 사용하기엔 살짝 부담되는 제형이라 피부 장벽이
무너졌다 느낄때 저녁에 사용하던 크림과 반반 섞어서 발라주고 있어요. 확실히 장벽 회복 속도가 빠르고 보습력도 좋습니다."
"5","2024.02.20","약건성","여름쿨톤","탄력, 다크서클","False","작아도 꾸덕한 타입이라서 오래 사용할 수 있을 거 같아요!
피부 자극받은 날에 나이트 케어용으로는 최고입니다!!!"
"4","2024.02.20","복합성","웜톤","잡티, 미백","False","피부 자극될때나 데일리로 사용하기 좋아요
다만 살짝 무겁고 끈적임이 남아서 밤이나 집에서 쉴때 사용하기 좋아요
진정도 잘되고 보습력도 좋아요"
"5","2024.02.19","복합성","쿨톤","미백","False","매번 사용하은제품이에요 피부과시술 받거나 자극받은 피부를 진정시켜주는데 탁월하네요 그외에도 건조하거나 트러블 생길때도 이만한 제품이 없아요 ㅎㅎ"
"5","2024.02.09","복합성","겨울쿨톤","피지과다, 모공","False","유분감 있는 크림이에요. 건조한 겨울철에 쓰기에 좋답니다."
"5","2024.02.09","민감성","봄웜톤","트러블","False","시카 성분이 함유되어서 그런지 피부 보습이랑 진정이 잘 되는 거 같아요!"
"5","2024.01.18","복합성","쿨톤","미백","False","써본 재생크림중에서는 가장 좋거 만족스러워서 매번 구매하는 제품이에요!! 밤에 바르고자면 그다음날 피부 컨디션이 너무 좋고 레이저시술 한 후에도 비싼제품 바를필여없이 이 제품 하나면 끝장이에여..💓💓"
"4","2024.01.17","복합성","웜톤","잡티, 미백","False","와우 좋은 해택+증정 와우 진짜 어려 종류 많이 받아서 고루사용중인데 몇가진 본품 구매해야겠어요ㅎㅎ

흡수가 늦어 극건성,건성이신분 외엔 밤에 사용하는게 좋을꺼 같긴해요ㅠ"
"5","2024.01.17","복합성","웜톤","잡티, 미백","False","진정시키고 싶을 때 자주 사용해요
계속 재구매해서 쓸 예정이에요"
"5","2024.01.17","복합성","웜톤","미백, 각질","False","바르고나면 다음 날 안색이 좋아지는거 같아서 자주 사용해요"
"5","2024.01.14","민감성","봄웜톤","잡티, 미백","False","오 발림성에 말이 많던데 이레이징크림? 그거보다 부드럽고 좋은데요! 근데 뚜껑이 왜이래요ㅠ"
"5","2024.01.10","건성","여름쿨톤","잡티, 트러블","False","자극없이 순하고 피부 장벽 개선에 도움을 준다고 해서 구매했어요 꾸준히 사용해봐야 알겠지만 피부가 많이 얇은 편이라 흔적 및 자국들이 남아있는데 어떨지 모르겠지만 일단 순하고 크림치고 가벼워서 기대하고있어요"
"5","2023.12.31","복합성","쿨톤","잡티, 미백","False","일단 너무 잘 안발려요 ㅠ 저만 그런건진 모르겠지만 한번 꼭 사용해보시고 사시는거 추천드리고 오특이랑도 가격차이가 꽤 나서 급하신거아니시면 오특때 구매추천합니다!!!"
"5","2023.12.23","지성","쿨톤","잡티, 블랙헤드","False","촉촉하고 겨울철에 사용하기 좋은 제형이라 구매했습니다 !!!"
"5","2023.12.02","지성","여름쿨톤","잡티, 트러블","False","지성+여드름인데 이거 너무 좋아요 ㅠㅠ왜 이제 샀는지 후회할 정도 이걸로 라로슈포제 알게 되고 라로슈포제 제품 써 보는 중이에여"
"5","2023.11.24","","","","False","너무 묽지도 꾸덕하지도 않고 발림성이 정말 좋아요. 

샘플이 정말 귀엽네요ㅎㅎ 민감성 피부라 잘 맞는거만 쓰는데 이거는 트러블도 안나고 잘 쓰고 있어요. 

겨울에는 수분크림을 살짝 더 바르는것도 좋을것 같아요."
"5","2023.11.22","지성","쿨톤","잡티, 블랙헤드","False","순하고 자극이 없어 겨울철에 보습주기 좋은 크림같습니다 만족해요"
"5","2023.11.14","민감성","봄웜톤","블랙헤드","False","좋습니당! 많이 꾸덕해서 집중케어가 필요한 부분에 발라주면 좋은 거같아요"
"4","2023.11.13","복합성","봄웜톤","잡티, 미백","False","환절기에 피부 장벽 무너지고 얼굴이 아플때는 평소에 바르던 스킨케어 제품을 전부 못바르구 연고같은 것만 바를 수 있는데 그나마 이걸 바를 수 있어요.

다른 재생크림 사용해본 적이 없어서 비교는 어려워요"
"5","2023.11.10","건성","웜톤","각질, 트러블","False","몇통이나 쓴지도 머르겠어요 ㅎㅎㅎ 진짜 좋음 .. 겨울되면 꼭 다시 찾는 크림 🩵🩵"
"5","2023.10.29","복합성","웜톤","잡티, 미백","False","크림 유목민인데 라로슈포제 시카밤이 그르케 좋다고 해서
한번 사봤는데 너무너무 좋아요!!!!!!!!
속건조가 심한편인데 요거 바르니깐 속건조없이 그다음날까지 촉촉해요~~~~
역시 인기 많은건 이유가 있는것 같아요!!"
"5","2023.10.27","복합성","","피지과다","True","수분크림 대용 보다는 민감할때 수면팩 위주로 좋을것 같아요 보습이 오래가진 않아요! 자연스러운 백탁 덕분에 메베 대용으로도 훌륭할것 같아요 민감성에 추천해요~~"
"5","2023.10.26","건성","웜톤","잡티, 미백","False","무조건 재구매 할 1순위템입니다
너무너무 좋아요
가을만 되면 가려워지는 알러지피부인데
시카플라스트 B5+ 는 가려움 진정 수분보충
다 만족시켜요
후기중  발림성 별루 화장이 밀린다...
건성인 저는 발림성 좋고 화장도 잘 먹어요"
"5","2023.10.13","복합성","겨울쿨톤","잡티, 각질","False","아침보다는 저녁에 진정크림용으로 바르고ㅠ있습니다!! 요즘 여드름이 많이 올라와 압출기로 짜고 난 후 연고 뒤에 바르고 있습니다!! 그 당일에는 붉은개가 비로 가라앉지는 않지만 자고 일어나면 많이 진정된 피부를 볼 수 있엉ㅎ~"
"5","2023.10.12","민감성","봄웜톤","블랙헤드","False","가볍고 끈적이지 않는 제형이에요! 피부과에서 피부 아좋으면 라로슈포제거 쓰라길래 구매했습니다. 이 크림이 나이트케어에 좋다고 하더라구요! 한번써보고 한달 후기 작성해보겠습니다 ㅎㅎ"
"5","2023.10.06","복합성","","피지과다","False","증정품이랑 궁합도 잘맞고 진정,보습도 잘돼요! 민감성, 그외 모든 피부타입에도 추천합니다~~"
"5","2023.09.18","복합성","쿨톤","잡티, 미백","False","아주살짝 뻑뻑한 발람성과 마무리감이끈적한 느낌이 있지만 다음날 아침 확실한 수분감과 진정에 좋음!
피부과 시술 후 사용시 효과 더봄
끈적함이 싫어하는 저에겐..발림성이 걸렸지만
그보다 효과가 좋아 계속사용중!"
"5","2023.09.14","복합성","","피지과다","True","그냥 이거하나만 발라도 될정도로 보습 좋고 흡수력도 좋아요 민감할때 바르면 확실히 진정돼요!"
"5","2023.09.07","지성","여름쿨톤","잡티, 각질","False","지성피부라 평소에는 이 제품이 무겁게 느껴져서 잘 안 쓰는데 피부장벽 무너진 때 (ex 빨갛게 되거나 갑자기 뒤집어질 때) 에는 약처럼 씁니다 진정효과가 좋아요"
"5","2023.08.31","복합성","","피지과다","False","확실히 발림성이 리뉴얼되고 더 좋아진듯 해요 여름엔 단독으로 발라도 될듯. 진정에 이것만큼 좋은거 없어요 추천합니다"
"5","2023.08.13","민감성","봄웜톤","","False","올영라이브에서 좋은 가격으로 팔길래 잘쓰던 제품이라 얼른 쟁였어요 발림성이 더 좋게 리뉴얼 됐다기에 기대중입니다
두번째 사진에서 왼쪽이 리뉴얼 전이고 오른쪽이 이번에 산 리뉴얼된 제품이에요"
"5","2023.08.06","지성","여름쿨톤","잡티, 각질","False","피부장벽이 무너진 것 같을 때 쓰기 좋아요 붉게 올라오고 뒤집어졌을 때 발라여"
"5","2023.07.11","민감성","봄웜톤","잡티, 미백","False","깔끔하게 발리지는 않아서 화장하기 전보다는 밤에 발라주고 있는데 확실히 좋은 느낌이 들어서 자주 사용하고 있어요."
"5","2023.07.07","민감성","웜톤","","False","가을, 겨울에 사용하기 좋을 것 같아요!! 보습이 엄청납니다…여름에 바르면 트러블 날 것 같아서 겨울 오기 전까지 존버하려구욤"
"5","2023.06.17","지성","쿨톤","각질, 트러블","False","항상 재구매하는 아이템입니다
이것만한 아이가 없어요
가격도 적당해요"
"5","2023.06.11","민감성","봄웜톤","잡티, 미백","False","제형이 흡수가 잘 되는 느낌은 아닌데 효과는 좋아서 자주 쓰게돼요"
"4","2023.06.11","복합성","쿨톤","트러블, 모공","False","피부 레이저나 필링시술등 후에 회복용으로 쓰기좋은 크림
건성인분들은 데일리 크림으로도 괜찮아요
굉장히 뻑뻑하고 유분기많은 크림이라
잘 펴발라줘야함"
"5","2023.06.04","민감성","웜톤","","False","건성, 악건성 필수템임당! 피부 장벽?재생? 둘 다 요 크림으로 관리하고 있습니닷!"
"5","2023.05.17","지성","쿨톤","각질, 트러블","False","항상쓰는 제품이라서 세일할때 미리 쟁겨둡니다 키왕짱 몇십병쓰는듯해요"
"5","2023.05.10","민감성","웜톤","","False","붉은기 케어에 효과적입니닷…장벽손상, 붉은기 케어 등등의 케어에 만족스럽게 사용 중입니다. 평소 붉은기나 피부 컨디션 안좋을 때 사용하기 좋을 것 같아요"
"5","2023.05.01","민감성","겨울쿨톤","트러블","True","가족들도 화상/상처난부위에 써보더니
좋다고해서 또샀어요"
"5","2023.04.22","민감성","겨울쿨톤","트러블","False","2만원대로 할인할 때 마다 사놓습니다....
계속쓸거라 쟁여놔요
사은품도 와서좋아요"
"4","2023.03.15","복합성","쿨톤","트러블, 모공","False","꾸덕꾸덕 찐보습!
복합성인 저는 겨울에 볼 턱 위주로 발라주거나
피부과 시술 다녀온후에 주로 사용합니다
건성인분들은 데일리 사용 가능하실듯

강한보습+피부재생 원하시면 구입하세요"
"5","2023.03.12","복합성","쿨톤","잡티, 주름","False","역시 올영이 체험단을 하는 이유가 있군뇨,,
예... 체험단으로 체험하고
제돈제산 하셨어요~^
증정도 땡큐!"
"5","2023.02.20","지성","가을웜톤","잡티, 각질","False","리뉴얼 됐다 그래서 새로운 건 줄 알고서 싰는데 기전의 거랑 같은 것 같은 느낌..? 그래도 트러블 안 나고 진정 목적으로 바를 수 있어 좋아요. 그래도 지성이라 전체에 바르지는 않아여!"
"5","2023.02.10","복합성","겨울쿨톤","잡티, 트러블","False","💜수부지

바르고 자고 나면 피부가 편안합니다.
바를땐 유분이 많나 싶지만 바르고 나서 흡수되면 번들거리지 않아요."
"5","2023.02.08","민감성","겨울쿨톤","트러블","False","사계절필수템! 피부컨디션이 안좋을때마다 바르고 푹 자고 일어나면 피부가 즉각적으로 회복되어있어요

아토베리어 365크림과 발림성ㅂㅣ교한 사진입니다"
"5","2023.01.21","약건성","","잡티, 미백","False","이거 한통이면 겨울을 잘 날수 있다는 말에 팔랑귀가 또 팔랑팔랑ㅠ 기존에 쓰는 제품들이 있지만 전 왜 이렇게 화장품 욕심이 많을까요. 또 사버렸습니다. 항상 갈증을 느끼는 피부때문에 저녁에 마무리 단계에 듬뿍 바르고 자고 있답니다."
"5","2023.01.19","민감성","쿨톤","트러블","False","계속 사게 되는 템.. 요새 피부 뒤집혔는데 밤마다 듬뿍 바르고 자니 진정되어있어요
또사야지"
"5","2022.12.21","복합성","웜톤","잡티, 블랙헤드","False","기획상품을 이번에 구매했는데 요롷고롬 쪼꼬만 미니미들이 4개가 같이 왔네요. 여행갈때 쓰면 되겠습니다."
"5","2022.12.21","복합성","웜톤","잡티","False","피부트러블 진정에 아주 좋아요. 레이저 시술후 진정에 주로 사용하고 있어요. 
아주 촉촉한 편은 아니라서 겨울철에는 이것만 바르면 당길수 있으니 에센스정도는 같이 사용하시는게 좋아요."
"3","2022.10.23","민감성","봄웜톤","주름","False","리뷰수정해요
1-2일 발랐을때는 보습크림(?) 처럼괜찮았어요
그런데3일차슬리핑팩처럼 사용하면좋다고해서
발랐더니 바른곳에 좁쌀처럼나더니 빨갛게
가려워졌어요ㅠㅠ
저랑은안맞네요"
"5","2025.11.22","복합성","쿨톤","잡티, 각질","False","날씨가 추워지면서 피부도 건조해지고 스트레스 때문에 피부 상태가 많이 안 좋아져서 고민하다가 구매하게 되었어요.부드럽게 흡수되면서 겉돌지 않고 피부 속까지 쫀쫀하게 보습이 채워지는 느낌이 들었어요.다음 날 피부가 한결 부드러워지고 촉촉하면서 많이 진정이 되었어요.요즘 날마다 꾸준히 바르고 있는데,피부 장벽이 튼튼해진 것 같아서 만족하는 제품이에요!"
"5","2024.06.15","복합성","웜톤","미백, 주름","False","피부과에서 뿌락셀레이져를 받은후 올리브영 매장가서 직원한테 강추받아 구매했습니다~39.000원에 ㅠ 이틀만에 인터넷들어와보니 만원이 할인됐네요ㅠ 넘짜증~여하튼~저는 지성이라 겉돌줄 알았는데 뿌락셀후 넘 건조해져서 그런가 듬뿍 발랐더니 첨엔 일본가부끼 처럼 백탁현상이 심하게, 하얗게 발렸지만 계속 문지르니 스며들어서 괞찬아졌습니다~수분감또한 최고구요 살짝만 꾸덕함이요~건조하신분들은 진짜 강추입니다~특히나 레이져시술후는 필수인것같아요~"
"5","2024.03.16","","","","False","진짜 세일할때 바로 구매하지 않으면
금방품절되는 제품이예요..
이번 세일에 빠르게 구매해서 다행입니다!

피부가 진짜 예민한편이라 원인모를 얼굴 붉힘으로
진정이 필요할때가 있는데, 시카밤을 발라주면
피부진정에 도움이 돼요!

약은아니지만 약처럼 바르는 용도로 몇년째
사용중입니다!"
"5","2024.01.20","","","","False","✅구매동기: 재생크림의 명가 라로슈포제! 재생하면 빼놓을 수 없는 크림이잖아요? 
겨울철이 되니 저같이 두 볼이 붉어지는 수부지 분들 반드시 있다고 보는대요
이거 방치하면 나중엔 좁쌀까지 올라오는 상황인거 아시나요?제가 지금 그런 상태입니다 ㅜㅜ
 직장에선 히타바람에 밖에 나갈땐 이도 시린 찬바람 어택까지...
쉴틈없는 내 피부... 선크림도 필수이니, 얼굴에 아무것도 안바르고 싶어도 직장인들
그럴 수가 없잖아요ㅜㅜㅜㅜ결국 얼굴이 붉어진채로 겨울내내 가라앉질 않더라고요. 
그래서 평소에 바르던 수분크림에 판테놀과 재생+보습을 보충하고자
또한 피부 면역력 증진과 장벽 개선을 위해서 구매해보았어요.

✅피부상태: 수분부족 지성,볼은 악건성, 코 모공과 나비존 세로 모공

✅피부밝기: 여름엔 22~23호, 겨울엔 21호

✅사용감: 다른분들 사용후기엔 뻑뻑하다는데, 저는 아니었어요! 엄청 꾸덕한 수분크림을 쓰고 있는
저로써는 라로슈포제 시카플러스트 밤의 첫 이미지는 크리미 하다! 였습니다. 너무 크리미해서
이거 수분이 절대 도망 못갈 크림이구나 하는 것을 확실히 느꼈고, 예전에 화장품을 사용 안하던 패기의 20대시절
시어버터 자체를(바세린보다 꾸덕) 얼굴에 펴바르고 살아본 저로서는 이정도는 흡수도 잘되고 발림성도 좋은 편입니다!

✅사용꿀팁: 라로슈포제 크림의 유효성분을 어떻게 하면 얼굴에 잘 흡수 할 수 있을까. 여러가지 테스트를 해보았어요. 
1. 얼굴 전체에 크림 자체로 도톰하게 얹기
2. 얇게 발라서 백탁이 없어질때까지 문질러보기
3.손등에 펴바른뒤 조금 더 부드러워진 크림을 얼굴에 펴발라보기

사용결과 3번방법으로 하는 것이 백탁없이 발리고, 흡수가 더욱 빨랐어요. 
백탁이 걱정되시는 분들은 저처럼 3번 방법으로 발라보시고, 마지막엔 1번처럼 도톰히 올리고 주무셔보세요.
아침에 피부가 깐달걀이 됩니다ㅎㅎㅎㅎㅎ

✅피부변화: 처음 붉었던 피부가 차차 가라앉는게 느껴졌어요. 
그리고 정말 신기하게도 왼 손등에 라로슈포제를 펴서 롤링한 후에 항상 얼굴에 올렸더니 
글쎄 그 왼 손등부분이 주름이 펴지고 하얗고 뽀얀 피부로 바뀐거에요ㅎㅎㅎ
오른손등이랑 지금 차이가 너무나서 신기해서 사진도 첨부했어요ㅎㅎ

✅장점정리: 
⭕️판테놀
⭕️병풀
⭕️시어버터
⭕️세콜지(세라마이드,콜라겐,지방산)
⭕️마데카소사이드 

피부재생과 진정에 좋은 성분만 가득한 라로슈포제!다쓰고 재구매할 의사 1000%입니다
        
        
              
                ... 더 보기"
"5","2023.12.29","민감성","봄웜톤","각질","False","☆한달 넘은 후기☆

저는 복합성에 민감성에 홍조까지 갖고있습니다.
여드름만 없다뿐이지 홍조때문에 고생하는데요
피부 장벽이 문제일 수 있다고 해서 장벽에 좋은걸로 서치하다가 몇년전에 공항에서 샘플로 준 라로슈포제 크림을 아주 잘 쓴 기억이 있어서 행사기간에 훅하고 샀습니다. 

제형은 조금 뻑뻑해요. 처음엔 살짝 잘 안발려서 묽은 로션을 먼저 바르고 그 위에 발랐어요. 그런데 점점 장벽이 좋아진건지 지금은 토너 바르고 이걸 바로 바를 수 있을정도로 많이 좋아졌어요. 

흡수는 잘 펴바른다면 금방 흡수됩니다만 처음 피부가 안좋을 땐 답답한 느낌이 들었어요. 아마 그만큼 제 피부가 안좋았던 상태였겠죠..ㅋㅋㅋ

수분감은 두말할 필요 없이 좋구요, 그래서 밀리지 않습니다. 산뜻함보단 촉촉하고 꽉 찬 느낌이 듭니다.

한달 좀 넘은 지금은(물론 식단도 병행하고 있지만) 눈에 띄게 좋아졌어요. 가끔 매운거 먹을때 빼고는 살짝 분홍색인정도? 앞으로도 대용량 원쁠원으로 행사 많이해주세요........살짜쿵 비싸요 ㅠㅋㅋㅋㅋ
        
        
              
                ... 더 보기"
