rating,date,skinType,skinTone,skinTrouble,repurchase,content
"5","2026.04.07","트러블성","가을웜톤","잡티, 주름, 트러블","False","올리브영에서 이것저것 담아서 선물하기 좋아요
매장에서 올영 선물 박스도 판매해요!
온라인도 있나 봐야겠어요
배송이 빠릅니다"
"5","2026.04.08","건성","여름쿨톤","블랙헤드, 피지과다","False","압출 후에 바를 크림 찾다가 가장 유명하다고 해서 구매해봤습니다 만족스럽습니다"
"5","2026.04.08","복합성","쿨톤","탄력","False","일단 전 건성이구요. 가아끔 티존에 유분이 올라오는데 거의 드물어서 그냥 건성이라고 생각해주시면됩니다. 홍조 있구요 염증 반응으로 인해 피부가 조금 맛이 간 상황입니다. 그래도 피부가 좋다고 말은 듣긴하지만 저에겐 좀 현재 피부상태가 좋지 않아요. 
그래서 장벽크림을 고민하다가 이 제품을 샀는데 이제품은 저녁에 바르는걸 추천드리고 냅다 얼굴에 많이 올리시면 절대로 안됩니다. 겉돌고 흡수도 안되고 결국 효과가 없어요. 
이건 엄지 손가락에 반마디만 짜서 한번 얇게 흡수시켜주면서 바르고 이후에 한번더 작게 짜서 얇게 펴바르면서 흡수시켜주면서 마무리해야 다음날 홍조가 가라앉은걸 확인 하실 수가 있어요. 
제발 냅다 많이 짜서 바르지 마세요 이건 얇게 펴바르고 흡수시키면서 레이어링을 해줘야 이크림의 진정한 효과를 누리실 수가 있어요. 밤형태라 조금 유분이 있는건 사실입니다. 하지만 건성분들은 제가 말씀드린대로 하면 답답함이 크게 안느껴지실거에요. 저는 두번만 레이어링해서 하는편이고 더 필요하신분들은 추가로 해도 됩니다만 제가 봤을땐 두번정도 레이어링 하는게 제일 무난한 것 같습니다."
"5","2026.03.20","트러블성","겨울쿨톤","잡티, 각질, 트러블","False","한 달 정도 꾸준히 사용해봤는데, 처음 며칠은 크게 차이를 느끼기보다는 자극 없이 무난하게 쓸 수 있는 정도였어요. 대신 계속 쓰다 보니까 피부가 예민하게 올라오는 빈도가 조금 줄어든 느낌이라 자연스럽게 손이 가게 되더라고요.  

제형은 살짝 꾸덕한 편이라 얇게 펴 바르는 게 좋고, 많이 바르면 답답하게 느껴질 수 있어서 양 조절은 필요한 타입입니다. 건조한 부위에 부분적으로 덧바르기엔 괜찮았어요.  

드라마틱하게 확 좋아진다기보다는, 피부 컨디션이 무너지지 않게 잡아주는 느낌이라 꾸준히 관리용으로 쓰기 괜찮은 제품이었습니다."
"5","2026.04.14","복합성","겨울쿨톤","","False","피부 뒤집어져서 마지막 희망이다 싶어서 구매했어요 트러블 다 들어갔어요ㅠ 저녁에 이제 얘만 바르고 자요"
"5","2026.04.14","건성","여름쿨톤","잡티, 미백","False","워낙 유명하니까 뭐.. 좋아요 무난하고
특별나게 좋은 느낌이라기보다는 걱정없이 쓰기 좋움"
"5","2026.04.10","민감성","봄웜톤","잡티, 트러블","False","전에도 작은용량으로 사서 잘 썼습니다! 흡수가 잘 안된다 싶으면 소량으로 여러겹 발라요! 아침에는 사용하지 않고 저녁에만 사용하는데 다음날 일어나도 건조한게 없어서 좋아요!!"
"5","2026.04.09","복합성","쿨톤","피지과다, 탄력","False","이 상품은 좋은거 다들 알거에요
환절기나 건조할때 두툼하데 발라주면 바로 피부가 개선되는게 느껴져요"
"4","2026.04.10","트러블성","겨울쿨톤","트러블, 블랙헤드, 피지과다","False","피부과에 갔다오고 나서 재생크림을 바르면 좋다고 했는데 수분크림 밖에 없어서 급하게 시켰어요 얼굴 엄청 붉은기가 심했는데 살짝 얹듯이 도톰하게 발라주니까 가라앉았어요🤍

단점은 펴 바를때 선크림처럼 백탁이 생겨서 진정용으로는 그냥 듬뿍 발라서 냅두는데 평상시에 쓸때는 수분크림이랑 섞어써야할거같아요😓 그리고 기름져서 지성분들이 평상시에 쓸땐 섞어바르거나 조금씩만 발라야할거같아요ㅎ 저도 수부지라 그렇게 해야하나 고민중... (+용기 입구가 너무 불편함ㅜ)

3-4일정도 세수하고 수분크림 바르고 수분크림이랑 섞어서 발랐는데 트러블도 딱히 안났고 진정효과가 큰거같아요💊"
"5","2026.04.03","지성","쿨톤","잡티, 각질","False","꾸준히 써보고 리뷰 남겨요 진정, 피부 보습으로 최고
근데 극 지성인분들 지성인분들은 소량으로 바르세요! 극 지성분들도 추천 . 

피부타입: 여름쿨톤+여드름 잘 생건됨+피지생성 잘되는 중성 예민한 약한피부+모공큼+피부 붉은 자국? 있음
피지연화제 잘 못 쓰고 피지제거제 도구 병행해서
피부톤이 붉은 자국이 고정되게 생겨서 노답이였는데
이거랑 클레어스 블루병 라인 같이 병행하고
아무래도 식습관 및 생활습관때문에 여드름때문에
그거 파티온(다x소)꺼 같이  쓰니까

몰라보게 피부가 좋아짐 피부가 속부터 보들보들하다고 할까요?
애기피부같은 질감됨
피부 예민한분들은 이거 쓰세요 저는 얼굴에 남은량 손등에도 바르는데 손도 되게 부드러워져서 만족
다 쓰면 큰거 사볼려고요 왜 유명템인지 알겠음 😭😭
너무 유명템이여서 그냥 극건성분들 용인줄 알고 안 샀는데 진작에 살걸 후회
        
        
              
                ... 더 보기"
"5","2026.04.03","","","","False","이거 왜안좋다는 리뷰 잇는지 모르겟슴.. 
필링겔 잘못써서 피부장벽 무너지고 피부는 뒤집어지고 
홍조에 피부 벗겨짐 엄청 심할때 비판텐연고 하나로 장벽 일주일망에 복구한 적 있어서 올영에서 유명한 판테놀성분 크림 사본건데 진짜 수부지나 건성한텐 너무너무 좋음 
자극1도없고 토너-세럼-라로슈시카 순으로 발르고 자면 
담날 개꿀피부 탄탄피부 되어잇음"
"5","2026.04.16","중성","웜톤","잡티, 미백","False","저는 주로 잠 자기 전에 사용하고 있어요~엄마가 요즘 너 뭐 바르냐고 물으시더라구요ㅎㅎ 얼굴이 빤딱빤딱한 것이 광이 난다고~ 예전에 써보고 올만에 다시 주문해 봤는데 좋구만요!"
"5","2026.03.05","","","","False","한달전에 사고 현재까지 쓰는 찐 리뷰입니다! 
(원래 리뷰 잘 안써요) 
피곤하거나 마법전.. 그리고 순하다고 하는 크림류들 다 써봤어요!!!! 크림류는 진짜 못발라요.. 바르는 순간 얼굴 간질간질해지면서 그 부분만 빨개져요.. 암튼 피부 개이상함.. 
라로슈포제 쓰기전에 ㅇㅅㅌㄹ 365크림 썼어요! 물론 순하지만 증상들은 여전했어요.. 그래도 순하다니까 계속 썼죠.. 장벽튼튼하게 만들라고... 근데 붉어지는 순간 라로슈포제 일주일만 써보자 하거 발랐는데 다음날 다 가라앉음..👍🏻 트러블도 바로 들어가던데요? 개 놀랐어요 진짜 .. 그래서 토너, 에센스 다 라로슈포제로 바꿨어요!!! 너무 좋음 ㅠㅠ 시카플라스트 토너 다이소에서 안개분사 미스트기 꽂은 후 사용 중이고 미스트처럼 얼굴에 뿌린 후 톡톡 치면서 흡수시켜준 후 시카에센스 한번 톡 짜서 바르고  라로슈포제시카밤 소량 덜어서 손바닥에 비빈 후 얹듯이 사용중이에요.. 이제서야 정착한 듯 해요!!!! ㅠㅠ 라로슈포제 진짜 좋아요 지금도 그날인데 트러블이 안나요....... 미쳤어요"
"5","2026.04.02","트러블성","여름쿨톤","트러블","False","피부과 시술 후 재생크림으로 사려고 샀어요 
효과 좋은 것 같아요! 
백탁 살짝 있고 꾸덕한데 미백에도 효과 있는듯 하고 
화장 전에도 얇게 아주 살짝만 바르면 밀리지도 않아요! (건성)"
"5","2026.02.27","복합성","봄웜톤","블랙헤드, 모공","False","겨울에 보습용으로 바르기 좋아요
꾸덕해서 발림성은 좀 떨어지는데 자기전에 바르면 담날 아침 매끈하더라구용

구매하고나니 더 좋은 기획상품에 할인들어가서 좀 아숩네요ㅠ"
"5","2026.04.07","복합성","","미백","False","피부 예민할 때 진정용으로 쓰기 좋아요. 꾸덕한 크림 타입이라 보습감이 확실하고, 바르고 나면 피부가 좀 편안해지는 느낌이에요. 대신 유분감이 있는 편이라 낮보다는 밤에 바르거나 건조할 때 부분적으로 쓰는 게 더 잘 맞았어요."
"1","2026.03.07","","","","False","진짜 좋다고 해서 사봤는데 진짜 역대급망템입니다
건조해서 발라도 보습효과 진짜 1도 없고 이거 쓰고 나면 오히려 훨씬 피부 건조해지고 붉어지고 뭐 진짜 많이 나있고 그래요 진짜 제발 사지마세요 어따 쓰라고 만든건지 쓸수록 더 이해할 수가 없어요"
"5","2026.03.31","민감성","쿨톤","주름","False","MD와 약간의 차이는 있지만 적응하고나면 보습제로 좋아요! 환절기와 봄에도 좋은듯. 올겨울내내써서 반통비었어요. 피지 없애는 피부과 약 먹고있는데 건조함 부작용 커버가능수준"
"5","2026.03.21","복합성","웜톤","주름, 다크서클","False","요거 샘플 먼저 써봤는데
좋아서 올리브영에서 구매합니다
자기전에 바르는데 아침에 일어나보면 진정효과 느껴져요"
"5","2026.03.17","민감성","가을웜톤","잡티","False","항상쓰는 제품입니다 피부가 의사도 추천하는 화장품 완전 강추합니다  꼭 쓰세요 피부가 넘 비씨요  최대한 관리받을  화장품 사세요"
"4","2026.03.25","트러블성","봄웜톤","잡티, 주름, 트러블","False","얼굴이 홍조도 있고 예민해서 수분만 사용하다가 재생도 중요하다고 인스타에서 글보고 주문
아직까지는 변화가 없지만 꾸준히  사용하다 보면 변화가 있겠죠"
"5","2026.03.23","민감성","웜톤","미백","False","생각보다 꾸준히 사용하니
보습에 아주 탁월한거 같아요
너무 좋아요"
"5","2026.04.11","","","","False","보습의 끝이라고 주변에서 추천을 받아서 샀는데
텍스처는 되게 꾸덕한데 바로 흡수돼요
그리고 촉촉한보습력 와...장난아닌데요?

다만 입구부분이 낮다고해야하나 깔끔하게 짜지진않는 패키지에 불만이...

한달사용후기와 함께 돌아올게요 커밍쑨"
"5","2026.04.04","","","","False","응급진정용으로 가지고 있으면 좋은템!

저는 이게 너무 좋은데 요즘 유튜버들이 안 좋다~ 라고 말하는걸 보긴 했어요.

사람마다 피부는 다른거니까~ 싶긴 한데 솔직히 피부 장벽 급격하게 무너졌을때 얘만한 크림이 없다고 생각하거든요.

데일리로 바를 제품은 아니고 피곤해서, 찬바람 맞아서, 자외선 많이 쬐어서 피부가 손상되었을때 바르는 제품이에요.

이거 하나 가지고 있으면 든든해요."
"5","2026.03.30","복합성","여름쿨톤","잡티, 트러블","False","말 안해도 누구나 애용하는 진짜 좋은 꿀템이지 않을까 싶어요!! 정말 트러블 잘 들어가고, 피부 개선에 매우매우 효과적입니다!!!!!! 동생, 엄마 모두 같이 쓰는데, 몇 통을 쓰고 있는건지 모르겠어요ㅎ 정말 효과 좋은 크림입니다:)"
"5","2026.03.18","","","","False","60대 초반의 여성이예요
유투브를 보다가 피부과 전문의인 자기도
사용하고 있다며
추천하는 영상을 보고 믿고 주문했어요

극건성 피부라서 겨우내 피부 당김이 심하고
스킨케어 후에도 종일 영양크림이라도 
덧발라야 했어요..

오늘 아침 처음 발랐는데요~
와~이런 제품 처음이예요 

스킨..  에센스..  그리고 '시카 케어밤' 꼼꼼히
펴바르고  영양크림..발랐는데요~
항상 건조함이 가장 심했던
입 주변이 자연스럽게 부드러워짐을 느꼈어요
건조함 1도 없이 말이예요..

화장을 하고 몇시간이 지났지만 전혀 건조함이
없어요 저에게는 정말 신세계입니다^^

손도 많이 건조한데 아깝지만
바르게되네요 ..
더시상 좋은제품 찾기위해 기웃거리지
않을것같아요..

괜히
6초만에 한개씩 팔릴만큼
유명한게 아니였어요..
건조하시다면 강추합니다👍👍
        
        
              
                ... 더 보기"
"5","2026.04.09","","","","False","피부 뒤집혔을때 이것만한것이 없어요 !! 꾸덕한 질감이긴 하지만 너무 번들거리지 않고 너무 좋아요."
"5","2026.04.08","","","","False","레이저시술후 쓸만한거 검색하면
이제품이랑 '바' 로시작하는 제품 많이 추천하길래
피부가 예민한편이라 3일고민 끝에  더이상 미룰수없어서 구매했습니다
시술로인해 지금 벌에쏘인것처럼 많이붓고  
열감심하고 건조한상태라
오늘드림 받자마자 
5ml 같이온거 틈틈히 덧발라서 5시간만에 다썼네요
아직 잘모르지만 써보고 한달리뷰 남기겠습니다 제발 부작용만 없었으면..

--추가--
더써봐야 알겠지만
이틀간 수시로 덧발랏는데 부어있고 붉은기 많이
완화되있네요 괜찮은듯
        
        
              
                ... 더 보기"
"5","2026.04.10","","","","False","피부가 갑자기 간지럽고 붉어져서 
급 구매했습니다. 
씻고 나서 바르고 자기 전에 해당 부위만 더 바르면 
그 다음날 좀 나아져서 만족합니다.
지성피부에는 살짝 기름지긴 하지만 좋아요."
"5","2026.04.09","","","","False","스킨케어 아침 스킨케어 마지막 단계 극소량 잠들기 전 듬뿍 
바르고 자면 아침에 피부톤이나 결이 확실히 달라요.

흉터 피부,홍조 붉은기가 있는 피부인데 진정효과며
모공케어에도 좋다 유분이 조금만 생겨도 피지량으로 
화이트피지가 금방 생기는데 이건 요물임
많이 바를수록 더 진정됨… 신기할정도 그리고 피부 좋아보임…  크림 타입보단 밤 타입 추천합니다 개인적으로
사계절 동안 써봤는데 트러블 없이 여전히 만족하며 사용중입니다.. 피부가 얇고 예민한 타입이라 왠만한 제품 재구매 한적이 없는데 라포슈 믿고 쓰는중! 

기초케어
메디힐 모공패드>디마르3 앰플>구달 청귤 비타 c> 
라포슈 밤 
충분히 모공 미백 주름 케어로 만족하는 스킨케어!
진짜 추천..(흉터피부 트러블 피부이신분들에게 더욱)
        
        
              
                ... 더 보기"
"5","2026.03.27","","","","False","피부 시술 받고 재생크림에 효과 좋은 듯 합니다~~그럴 때 바르고 있어오"
"5","2026.02.19","복합성","겨울쿨톤","미백, 각질","False","피부가 건조할때는 애스트라
피부기 예민항때는 라로 시카플라스트밤이면 해결이다"
"5","2026.04.11","","","","False","저희 엄마가 주문시켜달라고 해서 제가 사드리면서 저도 한 번 사용해봤어요 저는 완벽 그 자체의 지성이고요 샤워하고 나서 6시간 뒤면 개기름 올라오고 여드름도 올라와 있고 피부도 엄청 예민한편이예요
이건 제가 화장하기 전에 사용해보고 잠들기 전에 사용해봤는데요 요즘 화장이 맨날뜨는데 엄청 화장이 잘먹어서 기분이 좋았어요. 그래서 이건 화장하기 전에 꼭 바르는 것중에 하나예요 저같이 학생이신분들은 꼭 부모님 카드로 사세요 가격이 너무 사악해 그래도 그만한 값어치는 합니당"
"1","2026.04.04","","","","False","이 가격에 이도저도 아닌 제품이라고 느꼈습니다… 당장 뒤집혀 있던 피부가 진정되는 것처럼 보이다가 다시 이도저도 아니게 원상복구 되고, 오히려 괜찮았던 다른 부위에 트러블 올라왔습니다.
차라리 본인 트러블에 맞는 약국템 정리 찾아보고 맞춰서 사는게 훨씬 효과적일 것 같습니다."
"4","2026.04.11","복합성","쿨톤","각질, 트러블","False","확실히 장벽에 도움이 되는것같아요
약간 약…? 처럼 하얗게 발려서 밤에만 발라야해요 
보습은 적당히 되는느낌입니다"
"5","2026.04.14","","","","False","알러지 올라올 때 발라도 자극없이 바를 수 있는 유일한 제품이라서 없으면 안되요!!!! 온 가족 다 쓰기 좋습니당"
"5","2026.04.05","지성","겨울쿨톤","트러블, 블랙헤드","False","진짜 꾸덕해서 쓰기에 무겁긴 하지만
소량 꾸준히 바르면
피부 재생에 도움이 돼요~
자기 전에 바르면 더 도움이 돼요!!"
"5","2026.03.06","복합성","겨울쿨톤","미백, 블랙헤드","False","바르면 약간하얘 지고 다음날 아침 세안때 피부가 조금 달라진가같은 느낌이에요."
"5","2026.04.05","","","","False","워낙에 유명한 제품이라 2년 전쯤에 사서 써봤어요. 그때 써보고 잘 쓰다가 다 쓰고 다른 보습 제품들을 쓰느라 잊고 있었는데 즐겨보는 유튜버가 여행가서 이 제품 하나만 가지고 가서 스킨이나 에센스 다 없이 이것만 쓴다는 걸 보고 갑자기 또 너무 맘에 들고 사고 싶어서 다시 구매했어요ㅎㅎ 담달에 여행간 때 저도 이 제품만 가져가서 쓰려합니다! 건성에겐 최고의 보습력이에요!"
"5","2026.04.16","","","","False","베스트이기도 하고 보습이나 진정에 좋다고 해서 한번 구매해서 발라봤는데 제 피부에 확실히 보습에는 좋습니다~~
아침에 세안하고 피부 만져보면 보들하고 좋아요~"
"5","2026.04.13","","","","False","살짝 뻑뻑함의 제형임
접촉성 피부염 왔을때 샘플 사용해보고 좋아서 구매했어요
반나절 지나면 번들거림 살짝 올라옴
그런거 다 감안하고 효과있어서 만족함"
"3","2026.03.13","민감성","","트러블","False","며칠 안 써봐서 효과는 잘 모르겠음 조금 더 써봐야 좋은지 안 좋은지 알듯"
"5","2026.03.01","트러블성","","트러블","False","제 인생템 라로슈포제B+!! 장벽 무너졌을때 고생하고 
일주일 이거 아침저녁으로 듬뿍 바르고 피부 다시 돌아왔어요!! 겨울에 쓰기 너무 좋은데 여름에는 무거운감이 있을것 같아서 조금 발라주면 좋아요!"
"5","2026.04.08","","","","False","입 심심할때 먹기 딱 좋아요 간식대용으로 먹기 너무 좋네요 ㅎㅎ"
"5","2026.04.14","","","","False","음… 보습하면 아토베리어365크림하고 최근에는 Rhode에 베리어버터가 가장 인상깊었는데 역시 명불 허전이에요. 라로슈포제 시카플라스트밤은 다른결에 보습감이에요. 로드제품은 빡 나 보습에 최강자야! 첫 터치부터 강력함 보습감을 부여하는데 라로슈포제는 첫 터치는 두툼하고 바를때도 뻑뻑해서 잘 펴지지는 않아요. 그런데 사용후에 잔여감이 번들거리지 않고 산뜻한 마무리감이 느껴지더라구요. 잘 사용하고 한달레뷰도 남겨 볼게요. 겨울 보다는 간절기 봄이나 가을 지금이 딱 좋을거같아요."
"5","2026.04.14","","","","False","얼굴 지성+개복치에 완전 민감성타입임
좁쌀 거의 달고살았는데 진짜 이크림 자기전에 듬뿍 바르고 자면 진짜 미.친듯이 진정되어있음…너무 좋아여ㅠㅠ 써보고 진짜 혁명템이라 무조건 자기전 듬뿍 발라놓고 자고 밤 말고 크림도 샀는데 크림은 너무 밀려서 못쓰겠음…진짜 이제품 절대 단종하면안돼ㅠㅠㅠ!!!! 가격이 비싸지만 무조건 쟁여놓을꺼임…❤️"
"5","2026.04.13","","","","False","진짜 최고의 장벽구원템입니다.🔥🔥 피부가 매우 얇고 예민해서  클렌징 조금만 세게 했다하면 바로 피부 장벽 무너져서 따갑고 피부결이 안좋아지는 극예민피부인데 전에 쓰던 바이오더마 시카비오 크림 다 써서 라로슈포제 추천받아서 처음 사용해봤는데 아니 넘 좋아요!!!! 텍스처 넘 부드럽고 안무겁고 산뜻해요!!! 따가움도 전혀없구요! 저녁에 바르고 자면 아침까지도 보습력 짱입니다. 시카비오는 더 꾸덕한 제형이라 겨울에는 좋은데 여름에는 너무 리치하고 유분기가 돌아서 사용하기 어려울 것 같은데 라로슈포제는 유분기안돌고 너무 산뜻해요! 봄 여름에는 이 제품 쟁여놔야겠어용 장벽무너졌을때 아무것도 안바르고 이것만 듬뿍 발라주면 바로 장벽구원입니다. 단점은 백탁이 좀 많은 거랑 가격대비 양이 적은거ㅠ 그래도 또 살래요.. 저처럼 극예민 피부이신 분들 얼른 사셔요"
"5","2026.04.12","","","","False","확실히 꾸준히써주면 얼굴에 광이돌고 피부가 좋아지는게 느껴져요ㅎㅎ 환절기에는 필수템ㅜㅜ꼭한번 써보세요 그리고 동전만큼 짠다음에 얼굴에 그냥 막 올리지말고 손으로 펴서 소량씩 바를수있게 만들고 얼굴에 올려야 제대로 바를수있어오!"
"5","2026.03.30","","","","False","유명해서 한번 쯤 써보고 싶었는데 안 맞는 사람한텐 엄청 안 맞다 해서 걱정을 좀 했어요 크림보다 꾸덕한 제형이고 건성이시면 기름진 거 잘 못 느끼실 거에요! 그리고 바르고 나면 백탁현상이 좀 있어서 저녁에 바르는 거 추천드립니다 효과는 한달 후기로 다시 쓰러 오겠습니다"
"5","2026.03.29","","","","False","요새 볼쪽이 우둘투둘하고 붉게 올라와서 시카제품을 발랐는데 크게 나아지는게 안보였거든요.  그러다 예전에 이제품 쓰고 너무 좋았던게 생각나서 구매해서 발랐는데 정말 좋아졌어요!! 매끈해보이기도 하고 잘때 듬뿍 바르고 자면 다음날 붉은기도 다 사라지고 뾰루지처럼 붉게 올라오던것들도 가라앉아있네요!! 함량이 다른건지.. 좀 기름지고 냄새가 좋진 않지만 정말 적극추천합니다!!"
"4","2026.04.01","","","","False","제가 완전 심한 여드름 피분데 이소티논 먹으면서 피부가 엄청 건조해져서 걱정했는데 장벽이랑 보습 모두 너무 잘 잡아줘서 만족합니다!! 역시 믿고 쓰는 템🫶"
"5","2026.04.04","","","","False","라로슈포제밤은 올영 세일시에 자주 구입하는 제품이에요
이삼일에 한번꼴로 밤에 세안후 발라주고 자면 지친 피부에 도움이 되는것 같아요
피부과 레이저 시술후에도 도움이 된다고 해서 사용하기 시작했는데 용량이 많이 듬뿍듬뿍 바르게 되네요"
"5","2026.04.01","","","","False","복합성 피부라 T존은 기름지고 볼은 건조한 편인데, 시카밤 B5+는 무겁지 않으면서도 보습이 오래 유지돼서 좋았어요. 피부과 시술 받고 나서 피부가 좀 예민해졌을 때 바르면 다음 날 아침 확실히 진정돼 있는 게 느껴집니다.
질감이 좀 뻑뻑한 편이긴 한데, 소량만 덜어서 얇게 펴 바르면 충분하고 흡수되고 나면 촉촉하게 마무리돼요. 밤에 스킨케어 마지막 단계로 덮어 바르면 아침에 피부 결이 확 달라져 있어서 나이트 케어용으로 특히 추천합니다.
약간 백탁이 있어서 아침에 메이크업 전에 쓰기엔 좀 그렇지만, 저녁 루틴으로는 이만한 게 없는 것 같아요. 시술 후 회복기나 환절기에 피부 장벽 잡아주고 싶은 분들한테 강추!"
"1","2026.03.24","","","","False","일단 초민감성인저는 이거쓰고 다음날 홍조가 후끈거리면서 생기더라구요 순하다고들었는데  진짜피부는다 케바케구 피부상태에 따라 맞는분이있겠죠그런데 피부과에도 입점되어있다구 들었는데요 이거 저녁에바를때는 따갑거나 그런느낌없었는데요 다음날 보니 얼굴이 열감이따끔거리면서 화끈거리구 홍조가 생기고 그래서 피부 진정시키느라 진정제품 차갑게해서쓰고 그랬네요 피부가 초민감성이신분들은 궁금해서 쓰고싶으신분들은 
순하다고해도 본인한테 안맞는경우가 있으니  작은걸사서 소량테스트 해보구 쓰시는게 맞는 것같아요"
"5","2026.03.22","","","","False","겨울에 샘플 몇 번 사용해보고 열감 진정에 괜찮아서 본품 대용량으로도 구매해봤어요. 뾰루지가 눈에 띄게 가라앉는 건 아닌데 보습, 열감 진정에는 효과 있어요. 여름에도 쓸 수 있을지~ 모르겠지만 잘 쓰겠습니다. 백탁이 약간 있어서 자기 전에 바릅니다."
"5","2026.03.03","","","","False","❤️피부 장벽 무너지고 여드름 엄청 올라올때 응급 진정템으로 좋아요!

이거 안 좋다고 하는 분들은 이걸 데일리로 사용하는 분들이더라고요
이건 데일리 제품이 아니라 장벽 무너졌을때 응급 진정템이에요

유럽여행가거나, 찬바람에 오래 노출되면 얼굴이 차갑고 빨개질때
사용하면 좋은 제품이에요

그리고 한번에 듬뿍 올리기 보다 한 콩알만큼? 짜서 빨개진 부위, 장벽 무너져서 여드름 올라온 부위에 올리면 됩니다!"
