rating,date,skinType,skinTone,skinTrouble,repurchase,content
5,2026.04.01,복합성,가을웜톤,,FALSE,좋아요 크림이 저에게 잘 맞는거같아요 진정도 어느정도 되는거같고 그럭저럭템이에요
5,2026.04.01,건성,봄웜톤,"잡티, 미백",TRUE,앰플 사용하고 마무리로 크림으로 마무리해주면 짱임 튜브형으로 되는건 조절이 어려운데 이건 쉬워서 너무 좋음
5,2026.03.31,,,,FALSE,드라이기 할 때 항상 이 팩 얼굴에 붙이고 머리 말림 굿굿 나중에 또 살게용
5,2026.03.29,복합성,가을웜톤,"각질, 트러블",FALSE,맨날 회색 수분크림 유명한거쓰다가 피부에 관심잇는 친구가 좋다해서 바로 삿는디 오 역시 좋음 바를때 공병아 뭔가 편하고 무난한듯 굿굿
5,2026.03.24,복합성,쿨톤,잡티,FALSE,왠지 모르게 순한 느낌이 들어서 재구매했어요. 양은 많진 않은 것 같아요.
5,2026.03.21,복합성,웜톤,,FALSE,더 써봐야 알겟지만 피디알엔이 들어있으니 좋을것같긴하네욤
5,2026.03.21,,,,FALSE,"화장전에 바르면 피부 쫀쫀해져서 화장 잘 먹음
수분도 잘 채워줘서 만족햇어용"
5,2026.03.20,복합성,웜톤,"주름, 각질",FALSE,"아누아pdrn 수분크림!
발림성도 너무 좋고, 보습력도 마음에 드네요~!"
5,2026.03.20,건성,가을웜톤,"잡티, 각질",TRUE,선물용으로 샀습니당! 그냥 무난한 수분크림이에용 나쁘지 않은 .. 그런 .. 예
5,2026.03.19,,여름쿨톤,,FALSE,자극없이 순하고 마무리감이 산뜻하지만 보습은 잘 되서 네통째 쓰지만 마지막까지 쓰려면 통을 가위로 잘라서 긁어 써야하는게 너무 아쉬워요ㅠㅠㅠㅠ
4,2026.03.15,,,,FALSE,"가볍지만 촉촉한 수분감을 채워주는 데일리 수분광채 크림

피부가 건조해질 때 사용할 수분 크림을 찾다가 구매했어요. 기획세트라 본품 60ml에 추가 30ml 증정 구성이라 가성비도 괜찮다고 느꼈습니다.

제형은 너무 무겁지 않은 부드러운 크림 타입이라 피부에 잘 발리고 흡수도 비교적 빠른 편이에요. 바른 후에는 끈적임이 심하지 않고 촉촉한 느낌이 유지돼서 데일리로 사용하기 좋았습니다.

세안 후 기초 마지막 단계에서 사용하면 피부가 촉촉하게 유지되는 느낌이 있고, 메이크업 전에 사용해도 부담 없는 사용감이라 데일리 수분 크림으로 무난하게 쓰기 좋았습니다."
5,2025.05.27,,,,FALSE,수분감 많은 제형이고 지성 기준 환절기엔 꾸덕하지도 가볍지도 않네요. 다만 여름에는 기름질거 같은 느낌이라 양조절하면 될 것 같습니다. 지성피부 5월 말 기준 밤에 보습겸 진정 크림으로 사용하며 낮에는 조금 더 가벼운 크림 사용 중입니다.
5,2026.01.25,,,,FALSE,"지복합성 피부라 토너 세럼 잘 해주면 마무리 크림단계 때 이걸로도 충분해요.
PDRN은 잘 모르겠고, 세라마이드가 약간 들어가 있는거 같은데 비타민c 랑 궁합이 좋다고 해서 세럼 대신 비타민c 바르고 이 크림 발라줍니다.
그리고 선크림은 꼭 바르세요~"
5,2025.12.20,민감성,겨울쿨톤,블랙헤드,TRUE,"💙💙 직접 사용하여 보고 마음에 들었던 점 💙💙

 👉🏻👉🏻👉🏻 자극 없이 순해요 :

 아누아라는 브랜드는 워낙 유명한거 알고 있었는데 스킨 빼고는 안써봤는데요 워낙 광고에서 많이 보이길래 속는셈 치고 구매해서 써봤는데
건성 피부한테 넘 좋는 것 같아요!
써보고 잘 맞아서 세번 더 구매했어요!
PDRN이 저랑 잘맞는 것 같아용"
5,2025.12.20,민감성,겨울쿨톤,블랙헤드,FALSE,"💙💙 직접 사용하여 보고 마음에 들었던 점 💙💙

 👉🏻👉🏻👉🏻 자극 없이 순해요 :

 아누아라는 브랜드는 워낙 유명한거 알고 있었는데 스킨 빼고는 안써봤는데요 워낙 광고에서 많이 보이길래 속는셈 치고 구매해서 써봤는데
건성 피부한테 넘 좋는 것 같아요!
써보고 잘 맞아서 세번 더 구매했어요!
PDRN이 저랑 잘맞는 것 같아용
수분 폭탄인듯!!
사용 해 보고 좋아서 가족들도 하나씩 챙겨줬어용!
겨울이라 손이 더 자주 가는 것 같아용❤️💚💙🩵🧡
        
        
              
                ... 더 보기"
5,2025.12.09,건성,쿨톤,"각질, 트러블",FALSE,"민감성은 아니라서 기초란 순한거 아무거나 쓰면 된다 주의
그치만 끈적거리는 건 싫고, 기름진 것도 싫고, 악건성이라 촉촉해야 됨
<이런 마인드로 살아가던 세일할 때 유명한거 아무거나 산다 하는 수분크림 유목민인데 아누아 수분크림 써보고 너무 마음에 즐어서 올영세일에 원플원 뜬 거 보고 2박스 사버렸습니다

일단 밤 타입은 쓰다보면 먼지 들어가고 갈수록 묘하게 누런 빛으로 변색되는 것 같아서 한 80퍼 쓰고 나면 뭔가 찜찜한 기분이 드는데(저만 그런가요...) 튜브 타입. 이게 진짜 혁명이에요 토출구가 모기 주둥이..?처럼 생겼는데 개인적으로 일반적인 치약처럼 생긴 튜브타입보다 잘 나오는 것 같아요 출근 전에 바빠죽겠는데 안 나오는 크림과의 결투를 하지 않아도 된다는 점이 큰 장점이고 이 용기 형태에서 오는 만족도가 생각보다 굉장히 높습니다

크림은 엄청 부드럽고 촉촉해요 가벼운 느낌이고 마무리 기름진 느낌은 하나도 없음 전형적인 ’수분‘크림 느낌
제가 속건조+피부 당김을 심하게 느끼는 타입이라서 보통 수분크림쓰면 의사들이 선크림 바르라고 보여주는 500원 크기만큼 바르는데 이거는 훨씬 적게 써도 오랫동안 촉촉해요... 오랫동안 촉촉<이 느낌이 너무 좋아서 두 박스 사버렸습니다 그리고 다 쓰면 또 재구매할 것 같습니다

손가락에 쥐똥만큼 짜서 한쪽 얼굴 바르고 또 쥐똥만큼 짜서 반대편 얼굴에 발라요 그래도 이 겨울 칼바람에 피부 땡기는 느낌이 안 들어요... 아침에 대충 스킨케어하고 싶을 때 너무 편해요 그리고 흡수 빠르고 기름진 느낌은 없어서 크림 바르고 위에 쿠션 대충 찍어올려도 밀리는 느낌 하나도 없었음 근데 나이트 케어로 이거만 바르기에는 좀 가벼운 느낌? 저는 밤에는 세럼+앰플 쓰고 크림 바르고 있는데 일단 올 겨울은 이 루틴으로 정착하려 합니다
        
        
              
                ... 더 보기"
4,2025.11.10,민감성,겨울쿨톤,블랙헤드,FALSE,"🧡🧡 직접 사용하여 보고 마음에 들었던 점 🧡🧡

 👉🏻👉🏻👉🏻 환절기 추천템

 아직은 더 써봐야 알겠지만 일주일 써본 결과 촉촉하고 겨울철에 수분감 주기 좋은 것 같아엽!!🩵
건조해서 요즘 피디알엔이 유명하기도 하고 잘산거 같아욥🩵🩵"
4,2025.11.10,민감성,겨울쿨톤,블랙헤드,TRUE,"🧡🧡 직접 사용하여 보고 마음에 들었던 점 🧡🧡

 👉🏻👉🏻👉🏻 환절기 추천템

 아직은 더 써봐야 알겠지만 일주일 써본 결과 촉촉하고 겨울철에 수분감 주기 좋은 것 같아엽!!
건조해서 요즘 피디알엔이 유명하기도 하고 잘산거 같아욥!"
5,2025.09.03,건성,웜톤,"미백, 주름",FALSE,"아누아 크림은 처음 써보는데요! 제가 완전 악건성이라 제 피부에 맞는 크림 찾기가 어려웠어요 자기 전에 듬뿍 바르고 자도 아침되면 푸석해지는 제품이 많았거든요 🥲 그런데 아누아 PDRN 크림은 한번만 슥 바르고 자도 아침에 촉촉해요!!! 완전 대만족!!! 그리고 입구가 팁 형식이라 바르기도 매우 편해요 정착해야겠어요
역시 아누아 크림도 좋네요❤️"
5,2025.09.02,복합성,봄웜톤,"트러블, 피지과다",FALSE,이미 아누아 세럼을 사용 중인데 크림도 같은 브랜드로 써보면 어떨까 싶어서 구매했어요 전 복합성 타입인데 건조한 볼은 적당히 발라주고 유분이 제일 많이 생기는 코는 소량만 발라서 사용해요 pdrn세럼이랑 함께 사용해서 그런가 속건조가 잡히는 느낌이 들어요 그리고 드롭퍼 튜브형이라 실수로 크림을 너무 많이 짜내는 일도 없어서 괜찮아요!! 처음에 아누아 세럼살 때 후기 보고 나쁘지않아보여서 구매한건데 크림도 괜찮아서 아누아 제품을 계속 사용할 의향이 있어요
5,2025.08.20,,,,FALSE,"세럼 샀는데 증정품으로 받은 거 쓰고 좋아서 구매해버림
쫀쫀한 제형인데 발림성이랑 마무리감이 미쳐뜸
바른 뒤에 어라 좀 리치한가 라면 놉 조금만 지나면 싸악 스며들고 춱춱하게 보습감 유지가 미침 
나이트 루틴으로 이거 바르고 기능성으로 마무리 해주는데 다음날 피부 탱글함 미챠버림👍"
5,2025.07.08,민감성,봄웜톤,"잡티, 주름",FALSE,"매우 만족합니다. 
건성이 여름에 쓰기 좋아요. 
평소 기초 제품도 여러번 재구매할 정도로 아누아 제품하고 잘 맞는 편인데요, 피디알엔 수분크림도 잘 맞네요.
순하고 발림성도 굉정히 좋고요. 
이거 쓰면 다음날에도 피부가 촉촉합니다.
그래서 금방 쓰는 느낌이긴 해요... 아무튼 재구매 의사 있습니다."
5,2025.06.22,지성,,,FALSE,"처음에는 무난한 수분크림이라고 생각했는데 쓰면 쓸수록 만족함.
무겁지않으면서도 수분감은 적당히 채워주고 마무리감도 끈적이지 않음. 그렇다고 날아가는 마무리감 아님. 딱 정당히 편안하고 좋았음.
제일 좋았던거는 생각보다 진정도 잘됨. 피부장벽 무너졌을때 써봤는데 피부가 정말편했음. 다른 젤크림수분크림들도 화끈거렸는데 이건 화끈거림도없고 오히려 피부가 편안해서 피부 장벽 복구시키는 동안 아주 잘써줬음. 지성피부라 보통 장벽크림들이 무거운데 이건 무겁지 않고 수분감도 있으면서 진정도 시켜줘서 좋았음"
4,2025.06.03,,,,FALSE,"수부지이긴 한데 저는 확실히 히알루론산이 안맞나봐요. 한 일주일 쓰면 살짝식 트러블이 올라와요. 그리고 수부지이지만 수딩라인 좋아하는데 요건 제게는 살짝 오일리해요. 여름엔 잘 못쓸듯. 뒀다가 가을에나 쓸까 해요. (혜림쌤 유툽 보고 산 건데, 수부지의 범위는 역시 너무나 넓다는 걸 깨달았네요..ㅎ)"
5,2025.06.02,복합성,웜톤,"미백, 블랙헤드",FALSE,"아누아 피디알엔 히알루론산 100 수분 크림!!
수분감 가득한 제형인데 무겁지 않고 산뜻하게 마무리돼요. 여름철에도 부담 없이 사용할 수 있고, 피부 속까지 촉촉해지는 느낌이라 속건조 해결에 효과 있었어요. 메이크업 전에 발라도 밀림 없이 잘 올라가요. 유분기 적고 흡수 빠른 수분크림 찾는 분께 추천해요."
5,2025.05.13,복합성,,"잡티, 미백",FALSE,"✔️ 사용 기간: 한 달 아침/저녁 사용  
✔️ 피부타입: 수부지 / 민감성  
✔️ 특징: 진한 수분감, 무향, 레이어링 적합

한 달 동안 데일리 크림으로 꾸준히 썼어요. 텍스처가 묵직한 듯하지만 바르면 빠르게 흡수돼서 지성인 저한테도 부담 없었어요. 특히 피부가 민감한 날에도 따갑거나 붉어짐 없이 잘 맞았고, 속건조 케어에는 확실히 효과 있어요. 단, 극건성 피부라면 단독보단 오일류랑 같이 쓰는 걸 추천해요. 추가로 리들샷과도 잘 어울리더라고요"
5,2025.05.04,민감성,쿨톤,트러블,FALSE,일단 pdrn 앰플이 잘 맞는 것 같아 수분크림도 구매해봤습니다 원래는 에스네이처 스쿠알란 썼는데 마무리감이 너무 쫀쫀해서 조금 덜하고 보습감 있는거 찾았는데 이게 좀 보습감이 있길래 바꿔봤어요. 그치만 한여름엔 어려울 수도 있을 것 같습니다
5,2025.04.08,건성,겨울쿨톤,"잡티, 미백",FALSE,"아누아 PDRN 히알 세럼 후에 같이 사용하려고 구입했어요!
아무래도 같은 라인이다보니 좋겠거니 생각이 들었고
세럼 테스트 후 크림도 얹어봤는데 이거슨 완전,,,
속까지 수분을 아주 꽉잡아주는 속건조 관리,,!!!
거기에 PDRN까지,,, 너무 칭찬해요!!
촉촉함은 말해뭐해~ 세럼에 크림만 바르고 수면 후 기상했더니 마르지않는 수분감! 속까지 쫀쫀함이 살아있어요!

건성, 악건성은 아누아 PDRN 히알라인 인생템 될듯"
5,2025.03.25,지성,,,FALSE,"요즘 피부장벽이 무너졌는데 워낙 둔감성이라 집에 진정이나 장벽관련 제품이 없어서 사봄. 마켓진행할때 좋은 가격으로 샀음. 지성피부기준 가을겨울에 써야할것같은 마무리감이지만 피부장벽이 깨진 지금은 딱 좋은 정도임. 그렇다고 세럼처럼 광광한 마무리감도 아니고 끈적이는 마무리감도 아님.
많이 발라도 끈적이지 않았고 자기전에 듬뿍 발라줬더니 피부가 아픈게 진정이 됨. 건조함은 앰플로 잡아줘야 하지만 마무리 크림으로 잘 쓰고있음.
용량도 많고 뚜껑도 넓직해서 세워두기도 편함. 토출구가 뾰족해서 얼굴에 바르기 편하다지만 똥손인 나는 그냥 손에 짜서 쓰는게 더 잘발림."
5,2025.03.04,건성,쿨톤,"잡티, 주름",FALSE,"제 피부는 아주 건성이며 민감성이라 화장품을 잘못 바르면 곧잘 뭐가 올라오는 체질입니다. 그래서 제품을 선택할 때 굉장히 신중하게 선택합니다. 그런데 이 제품은 제 요구를 충분히 만족하는 제품이었습니다. 수분을 많이 함유하고 있고 여러가지 환경에 대한   장벽의 역할까지도 하고 있어서 아주   피곤하고 지친 날에도 이것을 바르고 자면 그 다음 날 얼굴을 보면 피부가 좋아진 느낌을 받았습니다.
그래서 꾸준히 사용해 보려고 합니다.
추천합니다."
5,2025.03.03,지성,쿨톤,,FALSE,"아누아 피디알엔 히알루론산 100 수분 크림은 정말 보습력이 뛰어나고 피부에 빠르게 흡수돼서 만족스러운 제품이에요. 꾸준히 사용하면서 피부가 촉촉하고 건강해지는 느낌이 들어요. 2개입 구성으로 가성비도 좋고, 가족과 함께 사용하기에도 좋아요."
5,2026.05.16,,,,FALSE,피부가 쫀득해져요 요즘같은 더운 날씨엔 많이 바르면 화장이 뜨긴 하는데 전엔 듬뿍 바르고 흡수시키고 화장하면 되게 잘 먹을 정도로 속건조도 잘 잡아줬었어요!
5,2026.05.15,,,,FALSE,"제품 퀄리티 좋아서 만족스럽게 사용 중입니다! 재구매 의사 있어요 :)
생각했던 것보다 훨씬 괜찮네요! 사용감도 좋고 데일리로 쓰기 딱 좋은 제품입니다."
4,2026.05.15,,,,FALSE,이거 은근 좋은 것 같아요 그냥 보습 잘 되고 생각보다 좋아서 다시 살듯요? 지성인데도 괜찮음
5,2026.05.14,,,,TRUE,정말 가볍게 수분만 채워주는 제품인거 같습니다 자기 전 듬뿍 바르고 자면 좋은거 같아요
5,2026.05.11,건성,쿨톤,,FALSE,자극없이 순하고 끈적임없는 잔여감이라 봄~가을에 사용하기 좋음
4,2026.05.09,민감성,봄웜톤,잡티,FALSE,"무난해서 쓰고있어요
다음에도 또 쓸지는.. 그때봐야 알듯"
4,2026.05.09,,,,FALSE,보습 크림으로 무난하게 쓰기 좋은 크림! 특히 여름철이라 끈적이지 않아서 더 좋은거 같아요
5,2026.05.08,,,,FALSE,타사 크림들 정착 못하고 쓰다가 이거 쓰고 바로 정착했어요 완전 추천
5,2026.05.08,,,,FALSE,무난~ 하게 좋아요! 입구가 위생적이여서 좋고 없으면.. 허전한 제품
2,2026.05.07,,,,FALSE,"움..어떠한 효과 아무것도 없고 걍 로션임
왜샀지....."
5,2026.05.06,,,,FALSE,무난합니다~ 장단점이 딱히 없어요 올영세일 때 궁금해서 샀는데 딱히 재구매하진 않을 듯요
5,2026.05.05,,,,TRUE,여기는 요 수분크림만 진짜 잘 만든것 같음.. 미스트랑 앰플는 잘 모르겠는데 크람은 진짜 수분 완전 꽝꽝 채워줌
5,2026.05.05,,,,FALSE,진짜 수분만 채워주고  기름은 없어요 전혀 너무너무 좋네요 굿굿
5,2026.05.05,,,,TRUE,진짜 딱 기름말고 수분채워지는 딱 그런느낌 너무너무 좋아요
5,2026.05.04,,,,FALSE,건성인데 요즘 피부가 너무 건조해서 구매해봤는데 무난하게 쓰기좋은거같아요!만족합니당💗
5,2026.04.27,,,,FALSE,"되게 촉촉하고 좋아요.
이벤트해서 구매했는데 생각보다 좋았어요!"
5,2026.04.27,,,,FALSE,건조할때 바르면 좋을거같아서 구매했어요~! 30미리도 있어 그건 여행용으로 좋을것 같아요!!
5,2026.04.27,,,,FALSE,좋아해서 종종 구매하는데 이 친구도 마찬가지로 양이 적고 비쌉니다..
5,2026.04.10,복합성,가을웜톤,잡티,FALSE,유독 이거 바르면 흡수되고 난 다음에도 광이 도는 피부 표현이 된달까
5,2026.04.10,건성,여름쿨톤,"미백, 주름",FALSE,좀 기름져서 겨울에ㅠ바르기 좋을듯 오빠가 좋아해서 계속 구매중
5,2026.04.10,지성,,,FALSE,연고같은 ㅋㅋ 너무좋아요 피부탄력과 꽉 채워지고 잡아주는 느낌
5,2026.04.07,복합성,,"잡티, 트러블",TRUE,"재구매템 
얼굴에 막 씌우는 느낌임
성분은 잘 모르겠는데 발림성 그리고 보습감은 좋았음 
화장전에 바르면 얼굴에 광 돌아서 자주 사용함"
5,2026.04.07,건성,,,TRUE,요 제품 바르면 관리하는 느낌이 들어서 좋아요! 잘 사용하고 있어요
5,2026.04.07,,,,FALSE,발림성이 부드럽고 흡수가 빨라서 끈적임 없이 촉촉함이 유지돼서 데일리 크림으로 사용하기 좋아요.
5,2026.04.06,지성,,"블랙헤드, 피지과다",FALSE,자극적이지 않고 수분충전 되는 수분크림입니다! 지성인데 겨울에 쓰기 좋았어요
4,2026.04.05,복합성,여름쿨톤,"잡티, 미백",FALSE,수분감은 있지만 금방 날아가는 느낌이라 가을 겨울 사용은 비추고 여름에 수부지 분들 사용하는 거 추천드려요
5,2026.04.05,,,,FALSE,건성추천크림이에요 윤광이 많이 돌아서 마음에 드네요 추천해요
5,2026.04.04,지성,봄웜톤,"각질, 트러블",FALSE,유튜브에서 추천영상보고 너무 사고싶어져서 구매했습니다
5,2026.04.03,지성,가을웜톤,"트러블, 블랙헤드",FALSE,저번 기획상품에 끼워져 있어 썻는데 좋아서 본품으로 구매했어요
5,2026.04.01,,,,TRUE,"잘 받았습니다. 너무 만족합니다.
성분도 믿음이 가고, 수분감, 지속력도 뛰어나고, 
아주 만족스러운 제품입니다."
3,2026.04.01,민감성,,,FALSE,"무난한 크림
근데 .. 바른 후 약간 뭔가 간질거리는 느낌..."
5,2026.04.01,민감성,가을웜톤,트러블,FALSE,진짜 맨날 건조해서 얼굴불편했던 사람인데 1통도 다 안썼는데 피부 편해져서 두통 쟁였어요 쌀때 무조건 쟁여!!
5,2026.04.01,,,,FALSE,부드럽고 좋아요 촉촉해서 좋급니당 꼭 쓰세요!!!!! 엄청 좋아용
5,2026.03.31,약건성,봄웜톤,"잡티, 트러블",FALSE,화장하기전이나 가볍게 바르기에 좋은 제품인 것 같아요!! 건성분들도 여름에 사용하시기 좋을 것 같습니다
5,2026.03.29,지성,여름쿨톤,"미백, 홍조",FALSE,"진짜 보습크림중 최고인듯..
건성인데 유분기 있는 보습크림 싫어한다?
진짜 완전추천
+수부지도 ㄱㄴ"
3,2026.03.25,,,,FALSE,피디알엔 효과가 있는지는 모르겟으나 수분크림으로 사용하긴 좋아요 꼭 할인 할 때만 구매해요
5,2026.03.24,,,,FALSE,"잘 받았습니다. 너무 만족합니다.
성분도 믿음이 가고, 수분감, 지속력도 뛰어나고, 
아주 만족스러운 제품입니다."
5,2026.03.23,트러블성,봄웜톤,"각질, 트러블",FALSE,미니샘플 써보고 좋아서 샀어요 바르고나면 은은한 광이 돌아서 메이크업할때 짱입니다
5,2026.03.23,민감성,웜톤,"트러블, 피지과다",TRUE,수부지인데 진짜 쓰기 좋아요 ㅎㅎ 넘 무겁지도 않고 보습은 잘 돼요!
5,2026.03.23,건성,여름쿨톤,"각질, 모공",FALSE,악건성이라 엄청 듬뿍 발라줘야 하지만 화장 전에 써도 안 밀리는 크림이라 좋아여
5,2026.03.20,건성,,"잡티, 미백",FALSE,아 최고에요 화장전에 발라주기에 너무 찰떡 바이럴 되는 화잘먹 크림 저리가요 이게최고
5,2026.03.19,복합성,웜톤,,FALSE,좋아요! 전 수부지라서 그런가 아침에 바르고 화장하면 ㅂㄹ데 밤에하면 좋ㄴ음
5,2026.03.19,민감성,웜톤,"잡티, 미백",FALSE,수분크림 애 좋아요.!!! 샘플 써봤다가 맘에 들어서 본품도 샀어요 부드럽고 그냥 무난하게 쓰기 넘좋
5,2026.02.11,복합성,웜톤,"잡티, 트러블",TRUE,"한달동안 꽤 ? 꾸준히 썼어요 30일 중에 한 20~25일정도 꾸준히 발랐어요 저녁마다 발라주었고 낮에도 가끔 발랐어요 ( 진짜 가아끔 ㅎ ) 사실 제가 비포 에프터가 궁금해서 찍어봤는데 제가 느끼기로는 점점 옅어지긴 했어요 !! 짙은 주름은 힘들겠지만, 얕은 주름들은 예방하기에 좋은 것 같아요 꾸준히 쓰면 더더욱 효과볼 수 있을 것 같습니다 !"
5,2026.01.12,지성,가을웜톤,"트러블, 모공",FALSE,"🌟 지성 + 트러블성 피부 🌟
가끔 급하게 외출하면 크림만 바른 피부로 뛰쳐나가서 버스에서 쿠션 뚜드리거든요? 다른 크림 바를 때는 버스타러 가는 그 짧은 시간에 찬바람+뛰어서열오름 때문에 피부 건조해지는데 ‼️얘 발랐을땐 찬바람 맞아도 피부에서 광나면서 보습감 유지됨!‼️ 그치만 보습이 좋다는건 웬만하면 유분이 많다는 뜻임 이건 딱 바를 때 유분감이 느껴져요 그래서 ❗️저같은 지성은 건조한 겨울에 쓰고❗️ 여름엔 절대 못씀 자기 전에도 잘안씀 담날 번들번들 기름광 나서… 그치만 요즘 잘쓰고 있습니다~
💢근데 이거 바르고 촉촉한 선세럼 바르고 쿠션 뚜들기면 시간차 두고 발라도 때처럼 밀려요ㅠ 선세럼 안바르면 괜찮길래 이 크림은 품기로 했습니다 선크림은 적당히 묽은걸러 발라야할듯!"
5,2025.11.21,복합성,웜톤,"주름, 탄력",FALSE,"요 PDRN보습크림.. 사용중인데요. PDRN 세럼이랑 같이 사용하니 시너지효과 좋아서요~!
흡수도 잘되고요. 사용후 수분감 가득해 좋아요~♡
속보습도 잡아주고요. 깊어지던 팔자주름도 옅어졌구요~ 이마 표정주름에도 사용중인데.. 효과좋은듯 해요~!ㅋㅋㅋ
이번에 1+1 행사중이라서..저렴하게 구매해서 기분좋아요~♡♡"
5,2025.11.15,민감성,쿨톤,"잡티, 각질",FALSE,이거 완전 대박!!!!! 요즘 환절기라 여드름이 하나하나씩 계속 나오길래 크림이랑 앰플 둘다 아누아꺼로 바꿔봤어요. 근데 진짜 뭐임??!!!! 쓰면 쓸수록 여드름이 없어져요!!!!!! PDRN이 들어가있어서그런가 얼굴에 광이 대박!! 그리고 얼굴에 크림바르자마자 시원해져요. 꼭 이거 사보세요. 제가 볼땐 복합성 지성 잘맞으실거같아요
5,2025.09.16,,,,FALSE,"피부타입:여름엔 복합성(T존,인중 유분)/겨울엔 건성
(계절 상관없이 속건조 조금 있는편이나 겨울엔 속건조 진짜 심해서 얼굴 당김)

스킨 로션 좀만 안맞은거 써도 금방 피부에 올라오는데 ,, 이거 샘플로 받아보고 사용했는데 너무 촉촉하고 흡수력도 빨라서 아주 광이 장난아니에요
그래서 이번에 한번 바꿔보자 생각하도 세럼이랑 수분크림 구매 완료-
속건조가 있어서 금방 마르면 안되는데 걱정했는데 촉촉함이 오래 유지 됩니당

수분크림은 입구가 작아서 한번에 많이 나올일도 없고 손등에 굳이 덜어서 사용할일 없는게 너무 좋았어요 그리고 유튜브에서 리뷰,광고가 많은 이유를 단번에 알겠더라구요 속에 수분을 가득 채워주면 피부 장벽 무너질일도 없고 그럼 화끈 거릴일도 없어요...! 

화장전에 사용할땐 무너짐이 있지않을까 했는데 웬걸 .... 피부화장 너무 착! 잘붙어요 
너무 과도한사용을 하는게 아니라면 가볍게 얹고 하시는걸 추천

‼️저와 같이 속건조로 고생하시는분들 ... 이거 꼭 사용해보세요 진짜 강추에요 속건조 잡아봐요 우리😎


(제 리뷰가 도움이 되셨다면 👍🏻  조심스레 눌러주세요)
        
        
              
                ... 더 보기"
