rating,date,skinType,skinTone,skinTrouble,repurchase,content
5,2026.05.17,민감성,쿨톤,잡티,FALSE,"악건성-건성 오가는 피부고 요즘에는 양볼이 많이 예민한 편인데, 자극없고 질감•흡수•보습•마무리감 등 전반적으로 좋은 것 같아요."
1,2026.05.15,복합성,겨울쿨톤,"각질, 트러블",FALSE,"너무 기름져서 모낭염나요
속건조도 잘 못잡아줘요 그냥 피부에서 겉돌아요"
5,2026.03.26,복합성,쿨톤,"잡티, 주름",FALSE,"임신하고 화장품 바꿔야한대서 구매해봣어요! 
잘 써볼개요!!"
5,2026.05.08,지성,웜톤,"주름, 블랙헤드",FALSE,"후기가 좋아서 처음써 봤는데 너무 잘쓰고있어요
굿굿 ㅋㅋㅎ"
5,2026.05.03,복합성,봄웜톤,"잡티, 트러블",FALSE,"복합성 지성 피부가 쓰기에도 좋아용 ㅎㅎ
최애 수분크림이라 한 통 다 쓰고 구매한 제품이에요!"
5,2026.05.06,,,,FALSE,발림성 좋네요. 구 적 거리지 않고 바로 스며들어서 마음에 들어요. 겉 돌지 않아요.ㅎㅎ
5,2026.05.09,,,,FALSE,"너무 순하고 보습이 좋아서 완전 맘에 들어용 ㅎㅎ
꼭 사세용."
2,2026.04.29,복합성,웜톤,트러블,FALSE,"pdrn은 절대 화장품으로는 흡수안되니 , 그거때문에 구매하시는 분은 없길바래요. 저는 한달 여행 앞두고 컴팩트하고 성분 무난한 크림 필요해서 샀습니다. 파우치에 들어갈 얇은게 필요한데, 대부분 80미리 100미리짜리 뚱뚱한 크림들이어서요. 
무난해요."
5,2026.04.08,복합성,봄웜톤,"잡티, 미백",FALSE,"자극 없고 보습 엄청 잘해주는 크림 🫰🏻
엄마 추천으로 쓰게 됐는데 벌써 재구매해서 3통째에오
단지형 크림 퍼서 쓰는거 진짜 시러하는데 이런 연고같은 입구 너어무 편하고 좋아요 !!🩷
제피부가 PDRN이랑 잘맞아서 그런지 데일리템으로 아주 잘쓰고 있답니다ㅏ
가성비도 좋은 거 같아요 ☺️"
5,2026.05.01,,,,TRUE,"너무 괜찮아서 가족에게 나누어주고 다시 구매했네요 ㅎㅎ 
저번에 산거 진작에 다 잘 쓰고 하나 더 샀어요 
단독으로 바르기에 겨울에는 살짝 가볍고
여름에는 살짝 무거워서 환절기에 딱 잘 쓰고 
겨울에는 다른 로션이나 크림 바르기 전에 덧바르는 용도로 사용하면 좋아요
( 참고로 저는 복합성인데 여름에 복합지성 겨울에 복합 건성 이예요 )"
5,2026.05.11,,,,FALSE,사은품을 받고 너무 잘 맞아서 본품도 샀어요 아주 잘 쓰고 있습니당
5,2026.04.19,,,,FALSE,수분감이 정말 좋아서 바르자마자 피부가 촉촉해지고 윤기가 돌아요. 가볍게 흡수돼서 끈적임도 없고 데일리로 쓰기 좋아요. 다만 건성 피부에는 조금 부족할 수 있어요. Overall 만족합니다 😊
5,2026.04.15,건성,봄웜톤,"잡티, 미백",FALSE,너무 무겁지 않은 밀착형 크림 제형입니다. 겉돌지 않고 피부에 착 붙어서 화장 전에 발라도 밀림 현상이 없었어요. 유명해서 사봤는데 잘 쓸거 같아요.
5,2026.03.23,복합성,웜톤,"잡티, 미백",FALSE,PDRN 크림으로는 번들대지도 않고 끈적임도 없어서 아침 저녁으로 쓰고있어요 순해요
5,2026.04.02,복합성,가을웜톤,"주름, 각질",FALSE,"안녕하세요 ~~~
매일 매일 아침 저녁에 세수하고 잘 싸용하는 제품이에요~ 진정하기에도 보습에도 좋아요~ 제가 또 화장 하기전에도 사용해요. 화장하기전에 써보니깐 화장이 더욱 오래 가고 화장품이 예날만큼 갈리지지 않은 촉촉한 느낌 있더라구요 🥰 잘 쓰고 있어용💜"
5,2026.05.16,건성,,"잡티, 미백",FALSE,"거울을 보니 이마에 목에 이 주름이 있더라구요ㅠㅠ 관리를 한다고 한건데 부족한거 같길래 속부터 케어 할수있는 그런 크림을 찾고있었는데 너튜브에 연예인들이 아누아꺼를 쓰고 계시더라구요 그래서 당장 매장 달려가야겠다 싶어서 갔는데 넘 비싸서 못샀지 뭐예요ㅠㅠㅠ 그래서 신랑에게 내 생일선물로 이거 사달라고 했더니 바로 가서 사라하길래 사서 다음날 바로 써봤는데 와 진짜 좋았어요
제형도 가볍고 흡수도 정말 빨랐고 속까지 쫀쫀하더라구요 밀림도 하나 없고 이거 바르고 화장하면 하나도 안뜨는게 신기했습니당ㅎㅎ 다쓰면 재구매 갑니당ㅎㅎ"
5,2026.05.08,민감성,쿨톤,"잡티, 미백",TRUE,잘바르고있는제품 아침용 으로 잘 바름 70대중반 피부도 잘 바르고 있음
5,2026.04.17,복합성,가을웜톤,,FALSE,수분감 짱짱하고 보습도 괜찮아요. 근데 자기 전에 바르면 얼굴에 번들번들 올라오는 감이 있는 것 같아서 자기 전에 바르는건 지성이신 분들에게는 비추해요. 아침에 진짜 조금 짜서 코팅해주는 것처럼 발라주고 선크림 올리면 화잘먹 피부 돼서 잘 사용하고 있습니다ㅎㅎ
5,2026.05.15,,,,FALSE,히알루로산 수분크림 건성피부에좋고 피부에자극없고 좋아요 굿굿굿
5,2026.05.03,,,,FALSE,주름에 좋다고 많이 들어서 목주름 크림으로 사용 중인데 괜찮은 거 같아요 엄마도 사드림 그리고 얼굴은 예민한 편이라 스킨케어 바꾸면 바로 올라오는데 이건 괜추나요 그래서 종종 얼굴에도 바르는 중! 근데 이건 왜케 까지는가요 ㅠㅠ 손에 다 묻어남 ㅠㅠ
5,2026.05.08,,,,FALSE,보습력 좋고 두개라 양도 많아시 좋네요 오래 촉촉한 느낌이예요
5,2026.05.06,,,,TRUE,"몇통 구매했는지 모를정도로 꾸준히 사용하고 있는제품
수분크림이나 연고 등 섞어서 같이 사용하니까 아주 좋음"
5,2026.04.12,복합성,쿨톤,"트러블, 블랙헤드",FALSE,광고보다가 구매해서 사용했는데 수분 충전할대 좋은 것 같아요
4,2026.03.27,지성,웜톤,"주름, 블랙헤드",FALSE,"처음사보는데 후기가
좋아서 바로구매했어요
좋았으면해요"
5,2026.05.07,,,,FALSE,크림 써보고 좋아서 재구매함. 튜브라서 나중에 잘라서 알뜰히 쓰기 좋아요
5,2026.05.12,,,,FALSE,요즘 피부가 많이 건조해서 구매했는데 수분감이 정말 장난 아니에요! 젤 제형이라 발림성이 아주 부드럽고 피부에 겉도는 느낌 없이 쏙 흡수됩니다. 바르고 나면 피부 속부터 수분이 차오르는 느낌이라 하루 종일 당김이 없어요. 끈적이지 않고 산뜻하게 마무리돼서 메이크업 전에 발라도 화장이 아주 잘 먹네요. 민감성 피부인데 자극 없이 순해서 매일 데일리로 잘 쓰고 있습니다!
5,2026.04.28,,,,FALSE,"광고믿고  구매해봅니다
전에 서용하던 제품에서  갈아탄것을 후회하지않도록"
5,2026.05.03,,,,FALSE,사실 광고처럼 그렇게 드라마틱한 효과는 없구요. 그정도를 바라고 산건 아니라 실망하진 않았습니다. 그냥 보습크림 정도 생각하고 구매하심 될거같아요
5,2026.03.30,복합성,웜톤,"잡티, 주름",FALSE,"광고 많이 뜨다가 수분크림 필요해서 샀어요
묵직하지도 가볍지도 않고 딱 좋아요"
5,2026.04.23,,,,FALSE,"앰플이랑 수분크림 같이 쓰면 씨너지 효과가 좋습니다
두가지는 계속 해서 사용하는데 크림이 무겁지 않아서 좋아요"
5,2026.05.05,트러블성,쿨톤,"트러블, 블랙헤드",FALSE,"요즘 수분크림 찾다가 구매해서 사용 중인데, 전체적으로 무난하게 잘 쓰고 있어요.

제형은 너무 무겁지 않은 크림 타입이라 바를 때 부드럽게 발리고, 흡수도 빠른 편이라 끈적임 없이 마무리되는 점이 좋았어요. 바르고 나면 피부가 겉도는 느낌 없이 촉촉하게 채워지는 느낌이라 데일리로 쓰기 괜찮았어요.

보습력은 엄청 꾸덕하게 오래 남는 타입이라기보다는, 가볍게 수분 채워주는 느낌이라 지성이나 수분 부족형 피부에 더 잘 맞을 것 같아요. 건성 피부는 계절에 따라 살짝 부족하게 느껴질 수도 있을 것 같아요.

꾸준히 사용해보니까 피부가 크게 뒤집어지거나 자극 느껴지는 부분은 없었고, 전체적으로 편안하게 유지되는 느낌이라 무난하게 쓰기 좋은 제품이에요.

용량도 2입 구성이라 가성비 괜찮은 편이고, 부담 없이 데일리용으로 쓰기 좋은 수분크림 찾는 분들한테 잘 맞을 것 같아요.
        
        
              
                ... 더 보기"
5,2026.05.17,,,,FALSE,재구매템이에요 제형이 마음에 들어서 또 구매했어요 유분감 크게 없이 띡하고 많이 바를 수록 더 진정되는 느낌 있습니다!
5,2026.05.11,,,,TRUE,"보습력이 좋아서 건조했던 피부가 오래 촉촉하게 유지돼요.
발림성도 부드럽고 끈적임 없이 흡수돼서 부담 없이 사용하기 좋았습니다.
메이크업 전에 발라도 밀리지 않아서 데일리 크림으로 만족하며 쓰고 있어요."
5,2026.05.10,복합성,봄웜톤,"각질, 모공",FALSE,"아누아 크림이랑 에센스 2년 가까이 사용중입니다
돌고돌아 다시돌아온 아누아 크림만 쓰면 효과가 들하니 에센스랑 꼭 같이 사횽하새요ㅠㅜ"
5,2026.05.04,,,,FALSE,촉촉하고 흡수도 좋아요 수부지피부라 수분을 중요시하는데 이 제품은 좋아요
5,2026.05.10,,,,FALSE,피부에 자극도 없고 데일리하게 사용하기 편한 제품이에요 추천!
5,2026.05.08,,,,FALSE,"광고보고 샀지만 진짜 효과가 좋아서 놀랐어요..
일단 효과가 너무 좋습니다. 자극이 하나도 없어요
계속 쓸것같습니다"
5,2026.04.15,,,,FALSE,한혜진 믿고 주문해봅니다 30대가되니 주름이 걱정인데 아직 효과는 모으겟지만 발림성좋고 자극ㅇ없어요
5,2026.04.25,,,,FALSE,"수분크림은 매일 쓰는거라서 이것저것 다 써보고
많이 쓰려고 해요. 광고도 많이 뜨고 후기들도 괜찮은듯해서
구매했는데 괜찮은것 같아요. 사계절 수분크림이 필요한
저에게 잘 사용해질듯 하네요."
5,2026.04.19,,,,FALSE,"발림성이 부드럽고 목피부에 빠르게 흡수돼서 사용하기 좋아요.
끈적임이 거의 없어 데일리로 쓰기 괜찮습니다.

보습력이 꽤 오래 유지돼서 피부가 촉촉하게 느껴져요.
부담 없이 사용할 수 있었어요!
주름 부위에 최고에요ㅠ"
5,2026.05.16,,,,FALSE,"오늘 오후에 시켜서 오늘배송으로 방금받았어요
SNS에서 워낙 유명한 목주름템이라 속는 셈 치고 한번 사봤어요 우선발림성은 좋아요 좁은 주름사이에 직접바르기 좋게 튜브형에 입구에 투명플라스틱으로 바로 주름에 짜서 쓰기 좋게되어있어 좋네요 오늘1일자 이니 꾸준히 한번 써보고 다시 리뷰 써야겠어요"
5,2026.05.15,,,,FALSE,처음 사용할 때는 큰 기대를 안 했는데 꾸준히 쓰다 보니 은근히 괜찮은 제품이라는 생각이 듭니다. 세안 후 바로 발라도 흡수가 빠르고 끈적임이 거의 없어서 사용감이 좋아요. 피부가 예민한 편인데 자극 없이 사용할 수 있었고 보습감도 적당한 편입니다. 화장 전에 사용해도 밀림이 없어서 데일리 스킨케어로 계속 쓰고 있습니다. 가격 대비 만족도가 꽤 높은 제품 같아요
5,2026.04.22,지성,,"잡티, 트러블",FALSE,일단 입구가 조절하기도 편하고 위생적이어서 메리트가 큰 것 같아요 사용감은 흡수가 잘되어서 지성도 불편 없이 쓸 것 같았어요 주름개선 효과는 잘 모르겠어요
5,2026.05.10,,,,FALSE,바르고 난 후로 속건조가 많이 잡혔어요~ 그런데 많이 바르면 약간 밀려요ㅠ
5,2026.04.17,,,,FALSE,피디알엔이랑 무슨 성분이랑 같이 들어있는게 흡수이 젛다그래서 찾아보고 이거 샀는데 꽤 효과 좋은듯
5,2026.04.15,민감성,쿨톤,"잡티, 미백",FALSE,처음으로 써본 제품  선우용녀님이 유튜브에서 좋다고해 나이든 사람한데 좋을꺼 같아 구매 역시   바림성이 흡수성도 좋아요
5,2026.04.08,트러블성,겨울쿨톤,"주름, 각질, 트러블",TRUE,이것맠 주구장창 쓰고 있어요 ㅋㅋㅋㅋ 1+1할 때 항상 사둔답니다 곧 또 사야겠어요
5,2026.04.04,,,,FALSE,사은품을 받고 너무 잘 맞아서 본품도 샀어요 아주 잘 쓰고 있습니당
5,2026.04.18,,,,TRUE,"믿고 쓰는 아누아… 
제품 자체가 너무 순하고 끈적임도 없고 완전히 보습만을 위해서 만들어진 제품같아요 ♡
여름에 써도 부담 없을 것 같긴 하지만,
개인적으로 이번 겨울에 이것만 쓰면서 덕을 많이 봤습니다!!
온가족이 아누아 정착했네요••• 🫰(4통째 쓰는 중)"
5,2026.04.09,건성,쿨톤,"미백, 각질",FALSE,"전체적으로 정말 만족스러운 제품이에요.  
처음 사용해봤는데 기대했던 것보다 훨씬 괜찮아서 놀랐어요.  
사용감도 편하고 부담 없이 데일리로 쓰기 좋은 것 같아요.  
가격 대비 퀄리티도 좋아서 가성비도 만족스럽습니다.  
다 쓰면 재구매할 의사 있어요!"
5,2026.05.18,,,,FALSE,두번째 구매하는 제품입니다 화장품 선택에 신중한 편인데 성분도 좋고 피부에 잘맞는거같아요
5,2026.05.17,,,,TRUE,"촉촉함의 끝판왕
한번 사용해보면 계속 구입하게되네요
매번 쟁여둡니다"
5,2026.05.17,,,,FALSE,"재구매했어요
바르기편하고저렴해요
발림성도좋아요
듬뿍듬뿍바르고있어요"
5,2026.05.14,,,,TRUE,"좋다고 들어서 사봤는데 진짜
좋아요 촉촉하고 순하고 가격
대비 진짜 좋네요"
5,2026.05.12,,,,FALSE,"단지형 크림이 아닌거에 한 표~ 
토출구가  갸름해서  쓰기 편함에 한 표~
발림성이 좋아 한 표~
약간의  광이 나는 것에 한 표"
5,2026.05.11,,,,FALSE,"아직 안 써봤어요
일단 써보려고 합니다. 좋으면 계속 쓰려고 해요"
5,2026.05.11,,,,TRUE,수부지 지성피부에요 수분관리를 위해 구매했어요 츄천받았어요
5,2026.05.11,,,,TRUE,항상 쓰던제품 순해서 맘에듬  써비스 제품도 감사 ㅎ 다쓰면 또찾아오겟음
5,2026.05.11,,,,FALSE,속건조 잡는 데 최고예요! 바르자마자 수분 광이 돌면서 피부가 쫀쫀해지는 게 느껴집니다. 끈적임 없이 깔끔하게 흡수되어 메이크업 전용으로도 너무 좋네요.
4,2026.05.11,,,,FALSE,언니가 써보고좋다고해서 구매했어요. 수분크림치곤 밀도감이 있고 마냥 가볍게만 발리지는 않아요. 그점이 저는 더 좋았던거같아요. 화장전에 발라도 밀림없어서 너무좋아요
5,2026.05.17,복합성,봄웜톤,"미백, 주름",FALSE,딱 무난한 수분크림 같아요 바른다고 엄청 촉촉해지지는 않지만 그래도 화장전에 바르면 좋은 것 같아요
5,2026.05.16,지성,,"미백, 각질",FALSE,"전에 얘에 대해서 너무 무난하다 했는데
이제는 그 무난함에 계속 사용하고있어요"
5,2026.05.16,,,,FALSE,촉촉하게 스며들고 피부가 편안해져서 매일 바르기 좋은 크림이에요
5,2026.05.16,복합성,웜톤,"주름, 모공",FALSE,"끈적이지 않아서 여름에 사용하기 좋은 수분크림입니다~
속까지 채워주는 크림이에요^^"
5,2026.05.15,건성,,"주름, 각질",TRUE,자극도 없고 튜브형태라 크림 바를 때 위생적이라 너무 좋아요 그치만 화장할 때는 왜이렇게 밀리는지 모르겠음 ㅠㅠ
5,2026.05.13,민감성,겨울쿨톤,"잡티, 미백",FALSE,이제 한 8-10통은 쓴거같은 찐템입니다! 속건조 잡아주는데 너무 좋아요 자기 전에 듬뿍 발라주면 다음날 꿀피부가 됩니당
5,2026.05.13,,,,FALSE,정말 잘 쓴 크림이에요 보습이 잘되고 순해서 잘썼어요 하지만 여름이 다가오면서 조금 무겁기 느껴질거같네요
5,2026.05.11,,,,FALSE,피부가 촉촉하니 너무 조아요 조아 최고예요 너무 조아요 조아
5,2026.05.10,,,,TRUE,"올리브영 세일할때 무조건 사고, 안해도 사는 제품입니다 추천!!"
5,2026.05.09,,,,FALSE,"이젠 없어서는 안될 최애템 👍 
피부에서 광이 난다고 주변에서 더  난리에요 ㅎㅎ
자신있게 추천해도 좋을 제품입니다."
5,2026.05.09,,,,TRUE,이 제품 정말 좋아요. 사용해 보니까 만족스러웠고 품질도 괜찮았어요. 다음에도 다시 구매하고 싶습니다.
5,2026.05.07,,,,FALSE,피부가 정말 좋아지고 흡수 잘 됨. 속건조 잡아줌 . 화장 전에 필수템.
5,2026.05.05,,,,FALSE,자극없이 순하고 발림성도 좋아서 가격대비 만족 합니다 양도많구요
5,2026.04.20,,,,FALSE,개인적으로 pdrn 성분이랑 잘 맞아서 만족하면서 잘 쓰고 있습니다!
4,2026.04.13,,,,FALSE,"트러블 없어서 좋아요.
광고가 너무 과한듯  ㅋ
그냥 보습력 좋은 크림정도?! 
그래도 트러블 없고 발림성 좋으니 만족!"
5,2026.04.06,,,,FALSE,수분 크림이에요 아침 저녁우로 바르고 찐자 촉촉하고 보습감이 넘쳐요
5,2026.04.04,,,,FALSE,"밤에 듬뿍 바르고 자면 아침에 피부가 촉촉해져요~
수분크림으로 너무 좋아요"
5,2026.03.30,,,,TRUE,"재재구매템입니디
기초 마지막 단계에 듬뿍 올려주지요
더 깊은 보습을 원하면 더 꾸덕한 제품이랑 섞어서 사용해도 굿입니다
떨어지면 불안한 제품이에요
주름에 효과가 있는듯"
3,2026.05.17,,,,TRUE,"여름에 가볍게 바르기 좋은거같아요
무겁지않고 편하게 잘 발려요"
5,2026.04.25,,,,TRUE,"요즘 피부가 건조해서 구매해봤는데 기대 이상으로 괜찮네요. 제형이 가볍고 끈적임 없이 흡수돼서 데일리로 쓰기 좋아요. 향도 은은해서 부담 없고, 사용 후에 피부가 촉촉해진 느낌이 들어요. 가격 대비 만족도가 높은 제품이라 재구매 의사 있습니다."
5,2026.04.21,,,,FALSE,제가 극극 지성입니다!! 지성이 쓰기에는 너무 많이 바르는건 추천 안하구요 자기전에 얇게 바르고 자면 다음날 피부 진짜 진주 피부 됩니다!! 거기에 화장하면 진짜 피부 결이 너무 좋아보여요!!!!!! 아누아 크림 바르고 화장하고 하루종일 화장 안무너졌습니다 추천 ㅠㅠ
5,2026.04.19,,,,TRUE,"아누아 PDRN 히알루론산 100 수분크림은 내가 진짜 꾸준히 쓰는 수분 크림 중 하나야. 이번에도 기획 2입으로 샀는데, 사용감이 너무 무난하고 편해서 데일리 루틴에서 손이 계속 간다.

처음 바르면 묽은 젤처럼 부드럽게 발리는데, 번들거리거나 겉돌지 않고 피부 속으로 차분히 스며드는 느낌이 들어. 발림성이 좋아서 스킨-세럼 단계에서 흡수된 뒤 바로 이걸로 마무리하면 윤기나지 않으면서도 속은 촉촉하게 잡아주는 그런 ‘수분 완충막’ 느낌이 난다.

특히 히알루론산 덕분인지 속건조가 심할 때도 당김 없이 유지되는 게 체감이 됐어. 낮에도 쓰고 밤에도 듬뿍 발라주면 다음 날 아침까지 속당김 덜해서 좋았고, 메이크업 전에 바르면 화장이 들뜨는 느낌도 확실히 줄어들었어.

그리고 자극이 전혀 없다는 점이 나처럼 예민피부에게는 가장 큰 장점. 따갑거나 붉어지는 일이 거의 없어서, 트러블 난 뒤에도 부담 없이 쓸 수 있고, 낮 동안 건조함만 해결하고 싶을 때도 편하게 쓸 수 있었어.

단점이라면, 이 크림 하나만으로 극건성 겨울 보습 완전 해결까진 어려울 수 있다는 점이야. 살짝 보습막이 가벼운 편이라 정말 건조한 날엔 크림이나 오일 한 겹 더해주는 게 훨씬 편안하게 느껴지더라고.

그럼에도 불구하고 여름·봄·환절기에는 진짜 무난하게 쓰기 좋은 수분 크림이고, 피부 자극 없이 촉촉함만 챙기고 싶은 데일리템으로는 충분히 만족스러워. 이번 2입 기획은 가격 대비 만족도가 높아서, 다 쓰면 또 재구매 의사 있는 제품이다.
        
        
              
                ... 더 보기"
5,2026.04.04,복합성,여름쿨톤,"잡티, 미백",FALSE,"엄마가 다들 좋다는 기초제품도 따갑다고 하셔서, 직접 테스트 해보고 사야 하는 피부 타입입니다. 그런데도 이건 잘 쓰시더라고요. 그래서 같이 쓰려고 재구매했습니다.
일단 짜서 쓰는 타입이라 위생적이고
적당한 수분 보습이 돼서 양조절 해가며 사계절 내내 쓰기 좋아요."
5,2026.04.11,,,,FALSE,"아누아 히알루론산 수분크림 좋아요 굿굿굿 
건성피부에좋아요"
5,2026.05.10,건성,겨울쿨톤,"미백, 주름",TRUE,좁쌀이 심한 시기에 써주면 넘 좋은 거 같아요 잘 쓰고 있습니당
5,2026.05.10,민감성,여름쿨톤,,FALSE,세일때 구매하면 가성비갑 제품력 갑이라 너무 좋아요! 무조건 구매하시는걸 추천합니당 😗❤️
5,2026.05.10,복합성,웜톤,주름,FALSE,세일기간에 가성비 너무좋게 구매한제품! ㅎㅎ 나중에도 더 구입할게용 💖
5,2026.05.09,트러블성,여름쿨톤,트러블,FALSE,피부 촉촉해지구 조와요 ! 여름에 쓰기 제일 좋은 제품입니잣
5,2026.05.08,건성,웜톤,미백,FALSE,수분크림이 필요해서 한번 구매했숩니다. 무난하고 좋네요
5,2026.05.08,트러블성,여름쿨톤,"트러블, 블랙헤드",TRUE,"살짝 따갑긴 한데, 수분 짱짱하게 잡리는 느낌이에요 2번째 구매인데 좋아요"
5,2026.05.06,복합성,여름쿨톤,"주름, 블랙헤드",FALSE,아직까지 큰 효과는 모르겟는데 우선 트러블 나는건 없어서 계속 쓰려구요
5,2026.04.15,,,,FALSE,보습 효과가 좋아서 세안하고 이 수분크림 하나만 발라도 충분해요!! 에센스나 미스트가 필요없더라구용 수분크림 찾고 계신분들이라면 이 제품 완정 강추입니다 저는 1+1할때사서 가격도 완전 착했어요 이 기회에 다들 쟁겨놓으세용!!!
5,2026.05.18,지성,봄웜톤,"각질, 트러블",FALSE,"유튜브에서 좋다고 해서 구매해봤습니다
그냥 무난무난하게 쓰기 좋은거같아요"
5,2026.05.17,,,,FALSE,수분이 채워지는게 느껴져요 촉촉하고 순해서 민감성도 쓸수있을듯
5,2026.05.17,민감성,겨울쿨톤,트러블,FALSE,"귀찮은 날엔 이것만 발라도 수분감을 잘 채워주고요
봄에 딱 바르기 좋은 수분크림입니다"
5,2026.05.17,복합성,웜톤,"트러블, 블랙헤드",FALSE,엥 갑자기 사고보니까 수지가 모델이됐네요 아누아 얼마나 잘되고 싶은건지 감도안옴 근데 일단 쓰고는 있는데 큰 효과는 모르겠음
5,2026.05.16,중성,가을웜톤,"모공, 다크서클",FALSE,적당히 수분으 잡아주고 무겁지도 너뮤 가볍지도않은 제형이라서 피부에 잘 먹어여
5,2026.05.11,지성,봄웜톤,"미백, 트러블",TRUE,여름엔 너무 무겁구 겨울에 히터 빵빵하고 그럴때 너무 건조하자나요 그때 딱이에요 그리고 코옆 사이에다가 듬뿍 올려놓고 자면 블랙헤드랑 요철 싹 사라져여
5,2026.05.11,복합성,가을웜톤,잡티,FALSE,"여러 수분크림 다 돌아봤지만 결국 이걸로 돌아오네요 
겨울에는 항상 장벽크림 발랐었는데 이번에 여름도 다가오니 또 재구매했습니다."
3,2026.05.09,건성,겨울쿨톤,트러블,FALSE,"그냥 무난무난한 것 같습니다! 
촉촉하고,, 딱히 막 엄청 인생템 느낌은 아니라서 재구매는 안 할 것 같아요"
5,2026.05.06,복합성,여름쿨톤,"잡티, 미백",FALSE,아리으내배으대리트네개두태추대헤미브케케즈개래지두태
5,2026.05.05,민감성,겨울쿨톤,"잡티, 미백",FALSE,주름제품으로 규래 !! 구매 사용중이네영 !! 괜찮나요 목이랑미나팔자에ㅜ바르고잇앙영
4,2026.05.05,,,,FALSE,선물한거라 직접 써보진 못했지만 워낙 올해 피디알엔으로 유명해서!
5,2026.05.04,복합성,웜톤,"잡티, 트러블",TRUE,잘 쓰고 있어요 마지막에 잘 안나와서 잘라서 쓰고 있는데 수부지 피부에 잘 썼어요!
5,2026.05.03,,,,FALSE,드라이기 할 때 항상 이 팩 얼굴에 붙이고 머리 말림 굿굿 나중에 또 살게용
5,2026.05.01,,,,TRUE,배송도 빠르고  복합성 피부인 저한테 너무 잘맞아요. 촉촉하고 발림성도 좋아요
1,2026.04.30,,,,FALSE,"ㅜㅠㅠㅠㅜ이런
바르자마자 트러블 올라옴…왜 샀지
너무 후회돼요"
5,2026.04.26,,,,FALSE,"Loved it....
Will purchase again...."
5,2026.04.25,,,,FALSE,사용감이 가볍고 흡수도 빨라서 데일리로 쓰기 좋아요. 피부가 한결 부드러워진 느낌이에요
5,2026.04.24,,,,FALSE,"광고보고 구매했어요.
100% 다 믿진않지만 기대해보고 사용해봅니다."
5,2026.04.23,,,,FALSE,촉촉하고 화잘먹피부로 만들어줘서 좋아요 건조한 피부에 광채 원하시는 분들 강추합니다~
5,2026.04.23,,,,FALSE,"발림성도 괜찮은거 같아요 목에 바르고 있는데 순해요
끈적임이 없어요"
5,2026.04.22,,,,FALSE,매일 사용중인데 깔끔하고 좋습니다. 첨 써보는데 재구매할것 같네요
5,2026.04.21,,,,FALSE,"촉촉하고 흡수좋고 오 이런제품이 너무 좋도라구요..
건성피부라 수분을 중요히 하는데  이제품 정말 좋네요"
