rating,date,skinType,skinTone,skinTrouble,repurchase,content
5,2025.09.10,민감성,봄웜톤,모공,FALSE,새로운 스킨케어 쇼핑은 언제나 설레네요.. 유튜브 보다가 광이 엄총 나길래 구매해봤오요 촉촉하고 역시 광이 쩌네요잉
5,2025.09.06,복합성,가을웜톤,"트러블, 모공",FALSE,아누아 제품이 보습에 좋다고해서 오특때 좋은 가격에 구매했어요! 무난하게 잘 쓸것 같고 보습에 좋습니다!
5,2025.09.06,복합성,봄웜톤,미백,FALSE,아누아 피디알엔 수분크림 보습에 너무 좋고 사용후에 촉촉하고 순해서 너무 달 사용중이에요 아누아 👍🏻😆❤️
5,2025.09.05,복합성,쿨톤,"잡티, 미백",FALSE,아누아 제품도 좋아하고 피디알엔에 환장해서 바로 구매갈겻어여
5,2025.09.03,복합성,웜톤,"주름, 탄력",FALSE,아누아 기초라인 자주 사용하는데 자극없어 좋아합니다. 올영세일기간에 저렴하게 구매해서 만족합니다
5,2025.08.31,민감성,여름쿨톤,"트러블, 블랙헤드",FALSE,제형이 묽고 가벼워요. 그래서 아침 저녁 모두 발라도 좋았어요. 특히 속 수분을 채워주는 느낌이었습니다. 화장 전에 써줘도 너무 좋았어요!
5,2025.08.30,복합성,웜톤,"미백, 주름",FALSE,아누아 제품 좋다해서 샀어요 ㅎㅎ 수분크림 2개줘서 기분이 좋아요
5,2025.08.17,,,,FALSE,튜브 형태라서 슥슥 바르기 쉽고 히알루로산이라서 부드럽고 촉촉해요.용량도 커서 듬뿍 바르기 좋아요.
5,2025.08.17,트러블성,봄웜톤,"트러블, 블랙헤드",FALSE,수분크림으로 좋아요! 순하고 보습 충전 ദ്ദി◍•ᴗ•◍) 튜브형이라 위생에도 더 좋은 것 같아요
5,2025.08.16,복합성,쿨톤,"트러블, 블랙헤드",FALSE,건조한 저에게 사용하기 좋은 제품인 것 같아요 기초 마무리 단계에서 사용하면 좋아요 촉촉합니다
3,2025.08.15,민감성,쿨톤,트러블,FALSE,일단 유분이 좀 있습니다 수분크림보단 유수분크림이라고 보는게 맞을 것 같아요 전 수부지다보니 밤에 유분크림으로 쓰기도 애매하고 낮에 수분크림으로도 쓰기 애매했습니다
5,2025.08.05,건성,여름쿨톤,"각질, 트러블",FALSE,"무향이고 흐르지 않는 제형입니다!
펌핑이나 동그란 입구가 아니고 세럼같이 길쭉해서 위생적으로 사용할 수 있습니다.
자극없이 순해서 휘뚜루마뚜루 막 바르기 좋아요."
5,2025.07.21,지성,웜톤,"각질, 트러블",FALSE,아침저녁으로 잘 사용하고 있어요 끈적임이 없어서 좋아요 구래서 손이 자주가네요
5,2025.07.16,복합성,겨울쿨톤,"주름, 각질",FALSE,"최근에 알게된 브랜드에
앰플이랑 크림 한달이상
써보고 좋아서 브랜드까지
좋아지네요 순하게 잘 맞아요"
5,2025.06.28,,,,FALSE,"수분이 많은 수분크림이에요
많이 건조할때는 두세번 더발라주어요"
5,2025.06.24,복합성,쿨톤,"잡티, 트러블",FALSE,라방에서 구매했어용 전부터 궁금했는데 저렴? 조금 저렴하게 샀네영
5,2025.06.12,지성,여름쿨톤,"미백, 주름",FALSE,"세럼이 좋아서 크림도 같이 구매했어요
용기가 피부에 바로 짤 수 있는 타입이라
위생적이어서 좋고
무엇보다 세럼이랑 같이쓰면
피부 속보습에 진짜 좋더라구요,,🩵"
5,2025.06.10,복합성,겨울쿨톤,"주름, 각질",FALSE,"가볍게 수분감있는 크림이라
맘에 들어요 양조절을 좀 잘해서
발라주면 딱일듯요"
3,2025.06.09,,,,FALSE,가성비는 좋은데 효과는 잘 모르겠어요 광고빨긴거 같기도??..
5,2025.06.09,트러블성,쿨톤,"미백, 각질, 트러블",FALSE,아누아 세럼 잘 사용하고 있는데 세일이라서 수분크림도 급하게 주문했는데 역시는 역시네요!!! 제형도 여름에 바르기 좋게 산뜻하고 시원한감도 있고 촉촉하고 안끈적거리는게 제마음에 쏙 듭니다!!@@@
5,2025.06.05,복합성,웜톤,"미백, 주름",FALSE,배송도 빠르고 제품도 마음에 들어요 배송도 빠르고 제품도 마음에 들어요
5,2025.06.03,건성,웜톤,"잡티, 미백",FALSE,"아침에 출근전에 세안하고 토너패드 닥토로한후에 토너> 세럼>로션>크림 이런게 사용하는데
아누아 세럼이랑  같이 사용해요
화장잘먹어요"
5,2025.06.01,민감성,여름쿨톤,"트러블, 블랙헤드",FALSE,한 번만 써도 피부가 좋아진 게 느껴진다고 해서 구매했습니다ㅎㅎㅎ 보습력을 기대하시면 안되실 거 같고ㅠㅠ 건성 아니시고 화잘먹 크림 원하시면 구매하셔도 좋을 거 같아요 :)
5,2025.06.01,,,,FALSE,"왜 지금 크림 하나만 눈에 띄는 거죠? 

크림을 많이 쓰는데, 지금까지는 이게 제일 좋아요! 

세럼을 사고 싶을 때마다 항상 품절되기 때문에 세럼이 궁금했습니다! 

세럼을 정말 사용하고 싶기 때문에 이번 세일에 재고가 많기를 바랍니다."
5,2025.05.25,복합성,여름쿨톤,"잡티, 미백",FALSE,올리브영 매장에서 테스트해 보고 너무 좋아서 구매한 제품👍🏻 속 건조에 아주 좋았어요ㅎㅎ 여름까지 무난하게 잘 사용할 수 있을 것 같아요👍🏻
5,2025.05.10,,,,FALSE,스킨보톡스 맞고와서 진정하려고 구매했어요 기기로 흡수시키면 물광이 나요
5,2025.05.02,,,,FALSE,"이 크림 감사합니다. 제 얼굴은 더 이상 건조하지 않지만 세럼도 주세요. ㅠㅠ
 세럼이 너무 구하기 어려워서 여기 올리브영 근처에서는 못 찾겠어요. 세럼 재고 좀 더 만들어 주세요!! ㅠㅠ"
5,2025.04.06,민감성,가을웜톤,잡티,FALSE,"히알루론산 수분크림 강력추천합니다 얼굴이  자주건조한데 사용하고 피부에  뽀송뽀송한 느낌입니다
건조함이 한결 좋네요"
5,2025.04.06,복합성,웜톤,"트러블, 피지과다",FALSE,아누아 피디알엔 앰플 크림 테스터해보고 너무 좋아서 바로 구매했어요
5,2025.04.04,지성,웜톤,"미백, 주름",FALSE,"한달동안 잘쓰고 떨어져서 또 사야하네요 
이번에도 올영에서 사야겠어요 
바로바로 필요하면 올영"
5,2025.04.03,복합성,쿨톤,"잡티, 주름",FALSE,그 인공눈물 같은 패키지 앰플을 크림으로 하셨대서 샀어요. 향 거의 없고 약간 묽은 겔 보다는 진한 제형 크림이네요. 릅수 잘되고 촉촉하고 팁이 있어 양조절도 쉬워요.
5,2025.03.31,,,,FALSE,아누아 피디알엔 엄청 잘사용중인데 크림도 좋아요 ㅠㅠ 아누아 피디알엔은 여러번 레이어링 해줘야 빛을 발하는 제품입니다
5,2025.03.28,복합성,웜톤,"트러블, 피지과다",FALSE,매장에서 테스트해보고 발림성 촉촉함 모두 마음에 들어 구매했어요 내 피부결 개선 도와줘
5,2025.03.23,,,,FALSE,"광고보고 샀어요
일단 성분이 착하구
건성이지만 피지가 있는데 보습력도 나름 괜찮아요
오늘 처음사용해서 아직은 모르겠어요"
5,2025.03.05,지성,웜톤,"미백, 주름",FALSE,"올영세일에는 꼭 필요한걸 쟁이기게 됩니다. 
이번에 구입한것도 꾸준히 쓸수밖에 없는 제품이구요 
많이 파세요"
5,2025.03.01,,,,FALSE,아누아 PDRN 세럼 2통 탈탈 비워 사용해서 크림도 믿고 구매했어요 !! 증정도 넘 좋아👍🏻❤️
5,2025.02.28,복합성,봄웜톤,"잡티, 트러블",FALSE,마냥 가벼운 사용감이 아니라 좋았고 용량 대비 저렴하게 구매한 것 같아서 마음에 들어요. 향이 없고 흡수력이 좋아서 무난하게 쓰기 좋은 제품 같습니다.
5,2026.01.19,트러블성,겨울쿨톤,"주름, 각질, 트러블",TRUE,이제 이거 리뷰 쓰기도 힘들어서 얼마나 샀나 캡쳐해옴 리뉴얼 하지마..성분 조합 바꾸지마…그리구 이정도 샀으면..뭐 없..나..요..?
5,2025.12.09,,,,FALSE,"수분크림 입구가 조절이 가능해서 떠서 쓰는것보다 훨씬 좋은거 같아요~
이번에 행사하면서 2개 득템해서 아끼멊이 듬뿍 바르고 다닙니다~~♡♡"
5,2025.03.08,,,,FALSE,너무 무겁지도 가볍지도 않은 제형인데 아침까지 보습을 탄탄히 해줘서 너무 맘에 들어고 바른 후 윤기도 대만족!!
5,2026.05.10,,,,FALSE,세럼과 같이 쓰면 더 효과가 좋은 것 같아요. 부드럽고 친하니까
4,2026.05.10,,,,FALSE,유분? 기름이 바르자마자 찝찝하게 느낌이 바로 와요ㅠ 자기 전에 무난하게 바르고 있긴 한데 재구매 의사는 없을 것 같아요ㅜㅠ 아쉬워~!
5,2026.05.09,,,,FALSE,아주 촉촉하고 자기 전에도 화장 전에도 촉촉하게 발라주면 좋아요
5,2026.05.08,,,,FALSE,촉촉하고 순하게 잘 발리고 바르고 나ㅕㄴ 물광도 좀 돌어용 굿굿
5,2026.05.07,,,,TRUE,몇번째 재구매인지 머르겠어요 제형도 가볍고 촉촉해서 매일 바르기 좋아여
5,2026.05.06,,,,FALSE,완전좋음. 무난수분크림으로 사용하기 너무 좋음. 세럼보다 이게 훨 좋은 듯
5,2026.05.05,,,,FALSE,"건조하고 푸석한 피부에 좋은 크림 같아요
처음엔  번들거리기만  한것 같았는데
저녁에 듬뿍 바르고  아침에 보니 흡수도 좋고
촉촉함이 속에서 올라오는 느낌이 드네요.
꾸준히 써보고 싶어요"
5,2026.05.05,,,,TRUE,"수분만 채우는 수분크림용으로 딱!! 입니다
가격도 나쁘지않음"
5,2026.05.04,,,,FALSE,엄마가잘쓰고계세요 자극없고 ㄱㅊ은듯 헤헤엄마이뻐져라
4,2026.05.03,,,,FALSE,"가볍게쓰기 좋아요
무거운느낌 아니라 아침에 화장전애 바르기 좋아여"
5,2026.04.16,,,,FALSE,여드름안나고 좋어요 촉촉하고 막바르는 수분크림이에요!
5,2026.04.15,,,,FALSE,지성인데 스킨케어 마무리 단계에 얇게 발라주니까 좋았어요 피부 쫜쫜해짐 근데 번들거리긴해서 밤에만 바릅니다
4,2026.04.13,중성,봄웜톤,"트러블, 다크서클",FALSE,앰플을 너무 잘 써서 같은 라인 크림도 한 번 사봤어요 앰플은 속수분을 아주 잘채워주고 흡수력이 좋은데 크림은 그냥 무난한 것 같아요
1,2026.04.12,,,,FALSE,솔직히 좋은지는 잘 모르겠어요 바이럴에 속아서 산 느낌 ... 재구매는 안할듯
5,2026.04.12,,,,FALSE,끈적거림 적어서 손이 더 자주 가는 것 같아요 속건조도 잘 잡아줘요
5,2026.04.09,,,,FALSE,동생꺼 몇번 훔쳐 쓰다가 좋아서 저도 구매 해 봤어요 만족합니다 좋아요
5,2026.04.08,,,,FALSE,"추천받아서 구매한건데 보습력 너무 좋아용!!!
유분이 많지 않아서 여름에 사용하기 딱이에요
추천합니닷"
4,2026.04.08,,,,FALSE,자극없이 순하고 수분감은 있지만 극극건성일땐 부족한 가벼운 베형
5,2026.04.07,,,,FALSE,바르자마자 피부 탱글 + 물광!! 무겁지 않고 흡수 잘돼서 계속 손이 가요.
5,2026.04.06,,,,FALSE,"엄마한데 선물을 해줬는데요 좋타고하시네요
또 사로가야겠어요"
5,2026.04.05,복합성,,,FALSE,수분크림 정착이용! 지복합성에도 좋아요 너무 무겁지도 가볍지도 않은 제형이에요!  세럼과 같이 쓰니 더 좋네여
5,2026.04.04,건성,여름쿨톤,"잡티, 미백",FALSE,가격값하는 느낌 흡수도 잘 됨 완전 극 건성이라 평소에 뭘 해도 건조햇는데 이건 이것만 발라도 ㄱㅊ앗음
4,2026.04.04,,,,TRUE,필요해서 구매했었구 잘사용했어용ㅎ 좋은가깉아용ㅎㅎㅎ
4,2026.03.31,,,,FALSE,무슨 효과가 있는건지는 잘 모르겠지만 바르고 나서 담날에 일어났눈데 피부 컨디션이 좋아보였어용🤩
4,2026.03.31,,쿨톤,블랙헤드,FALSE,건성 피부가 사용하기에는 저녁에는 가볍고 아침에 사용해야 좋아요.
3,2026.03.29,,,,FALSE,"무난하게 쓰기 좋은 수분크림,,,?
제가 악건성이라 그런지 두번 발라야 수분감이 느껴지는 느낌,,,?"
4,2026.03.28,,,,FALSE,"꾸준히 사용하는 제품이에요 ^^*
할인할 때 적당한 가격으로 잘 샀어요"
5,2026.03.27,,,,FALSE,끈적거림도 없고 흡수도 잘 돼서 좋아요 용량도 커서 오래 써요
5,2026.03.25,,,,FALSE,앰플 기획세트에 잇는 거 쓰다가 너무 좋아서 수분크림 이거에 정착햇어여ㅎㅎ
5,2026.03.25,,,,FALSE,"촉촉하게 발림성 보습 괜찮아요
무난하게 좋은 크림
잘쓰고있습니다"
5,2026.03.23,,,,FALSE,엄청 묽은 수딩크림보다는 적당히 꾸덕하고 바른후에는 촉촉광이 겉에 맴도는것보단 속보습 채우기 무난한 템이라고생각합니다.
5,2026.03.23,지성,,"잡티, 각질",FALSE,"친구가 추천해서 샀어요
보습 좋아서 밤에 마지막 단계로 많이 바르고 자네용"
3,2026.03.21,,웜톤,"잡티, 미백",FALSE,촉촉하긴 한데 PDRN함량이 아쉬워요 ㅠㅠ 재구매 의사는 없습니다..
5,2026.03.01,건성,겨울쿨톤,"미백, 트러블",FALSE,"아진짜 너무 좋습니ㅏ…
말이 필요 x
지성이라면 좀 비추 피디알엔 제품들이 전반적으로 산뜻한데 뭔가 본능적으로… 피부에 뭐가 좀 나면 기름이 ㅁㅊ듯이 겉돌거라는 생각이 들어서 손이 안 가더라고요(특히 같은 라인 세럼) 뭔말알? 그래서 건성들에게는 강추!!!!!!!! 지성은 사바사인 듯! 
긍대 제품력은 짇짜 너무조아요… 저는 너무너무 잘 맞고 화장 전에도 자주 씀"
5,2025.12.18,건성,여름쿨톤,"트러블, 블랙헤드",FALSE,"속건조 때문에 수분크림 이것저것 써봤는데, 이건 자극 없이 순한데 수분감이 오래가서 만족했어요.

✔️ 제형
꾸덕하지 않은 젤-크림 타입이라 바를 때 부드럽게 펴지고, 흡수도 빠른 편이에요. 끈적임 거의 없어서 아침 메이크업 전에 발라도 밀림 없었어요.

✔️ 보습력
바르자마자 촉촉한데 겉도는 느낌 없이 피부 속까지 수분 채워주는 느낌! 시간이 지나도 당김이 적어서 건성·속건조 피부에 잘 맞을 것 같아요.

✔️ 피부 진정
트러블 올라오기 직전이나 피부 예민할 때 발라도 따갑거나 자극 없었어요. 요즘 피부 컨디션 안 좋을 때 자주 손이 가요.

✔️ 추천 대상
   •   속건조 심한 분
   •   끈적이는 수분크림 싫어하는 분
   •   데일리로 순하게 쓸 크림 찾는 분

재구매 의사 있고, 사계절 데일리 수분크림으로 무난하게 쓰기 좋은 제품이에요 👍
        
        
              
                ... 더 보기"
4,2025.12.13,민감성,쿨톤,트러블,FALSE,"가벼운 젤타입의 크림이에요
PDRN성분이 피부재생에 좋다해서 구매했는데 재생까지는 모르겠고 그냥 가벼운 수분크림 바른거 같아요
앰플보다 조는 개인적으로 보습쪽으로는 크림이 더 나른것 같아요
꾸덕한 제형의 크림이랑 섞어바르기 좋아요"
5,2025.12.09,복합성,쿨톤,"각질, 모공",FALSE,"이제 겨울이고 수분크림 선택이 중요한 시기인만큼!!!!이번에 아누아 피디알엔 라인으로 기초라인 바꿔봤어요~!!!세럼이랑 같이 사용하면 효과 더 좋겠죵??💕 사용 이틀차인데 짜서 쓰기도 넘 좋고 발림성,향까지 다 너무 맘에들어요~~!! 역시 피디알엔 최고...!!"
5,2025.10.16,민감성,쿨톤,트러블,FALSE,"수분크림과 영양크림을 반반 합쳐놓은듯한 제형이라 가볍지도 그렇다고 무겁지도 않은 제형이라 너무 좋아요
이제는 없어서는 안될 제품이에요
더운여름철에 발라도 무겁지않았고 이제 춥고 건조한 날씨에도 발라도 될만큼 수분감이 좋아요
저렴하게 하나가격에 두개를 겟 했어요"
5,2025.10.03,건성,여름쿨톤,각질,FALSE,안녕하세요 아누아 광녀입니다 아누아 크림 6월 올영세일 때 산 거 다 안 썼는데 너무너무 좋은 제품이라 세일할 때 쟁여뒀습니다 크림 로션 발라도 뭐가 좋은지 모르겠다 수분 충전되는지 모르겠다 진정되는지 모르겠다 생각하는 분들 그냥 이거 사세요 더 이상 말 안 하겠습니다 자고 일어나면 피부 회복력이 미쳤어요 거의 탈피해서 좋아지는 수준으로 좋아져요
5,2025.10.03,건성,여름쿨톤,각질,FALSE,제 피부가 예민한 편이라 자기 전 바르고 일어나면 안 맞는 제품은 피부에 항상 붉게 뭐가 올라오는데 이건 전혀 그런 게 없고 좋아요 흡수도 잘 되고 광 올라오는 것처럼 피부가 아주 좋아보이고 얇게 발라도 수분이 많아서 바르고 자고 일어나면 피부가 좋아져요
4,2025.09.12,민감성,웜톤,잡티,FALSE,원래 피부가 워낙 예민해서 타제품 수분 크림 사용하다이거로 넘어왔어요 세럼보단 손이 덜 가지만..테스쳐가 끈적이지 않고 좋아요 아직 사고 몇 번 밖에 사용안했지만 건성인 저한텐 좀 단독으로 사용 하기엔 부족함이 있는 것 같은 기분이 드네요..
5,2025.09.07,복합성,여름쿨톤,"블랙헤드, 모공",FALSE,동네 올리브영 매장엔 아누아 수분크림이 있지 않아서 엄마가 아누아 공홈에서 구매해서 쓰던 거였는데 이번에 매장 방문하니 있더라구요! 본품 하나 더 주는 기획은 오프라인 매장에 없길래 온라인으로 주문해드렸습니다! 순하고 촉촉하다고 좋아하세요 ㅎㅎ 이번에 같은 라인 토너로도 구매하셨더라구요
5,2025.09.04,,,,FALSE,"첫 번째가 아누아 pdrn크림 바르기 전이고 두번째 사진이 바르고 3일 후에요!!

만성 홍조+지성+가끔씩 뒤집어지는 민감 피부입니다..ㅜㅜ
이번에도 갑자기 홍조와 좁쌀이 올라와서 진짜 너무 힘들었어요
이럴때 판테놀연고를 바르곤 했었는데 이번에는 효과가 미미하더라고요

이번에 현재이벤트+아누아데이여서 한 번 사볼까 하는 마음에 가볍게 사용해봤는데 그렇게 안없어지던 좁쌀이 바로 사라졌어요.. 솔직히 좁쌀말고도 그냥 피부결자체가 달라졌어요 화장하면 그냥 매끈해보여요(진짜 선녀같다...)

저는 원래 사용하던 히알세럼이 있어서 히알세럼+pdrn크림 사용했는데 이번에 너무 좋았어서 세럼 다 떨어지면 pdrn라인 히알세럼으로 갈아타보려고요!!

살짝 기름지기때문에 저처럼 지성인분들이 망설이실 수도 있는데 자기전에 문제 부위에 올려주기만하면 부담없는거 같아요!!

넘 좋아서 엄마한테도 하나 드리고 효녀소리들었습니다.. 1+1으로 사고 효녀소리 듣기 너무 감사햇서요🥹🥹

아누아짱.. 이걸 알게해준 현재도 짱..
아누아앤현재 사랑합니다🧸🤍🧸🤍
        
        
              
                ... 더 보기"
5,2025.09.03,,,,FALSE,"이번에는 아누아의 pdrn 히알루론산 100 수분 크림 60ml짜리 2개입 세트를 내돈내산 해봤숩니다 ( ᐕ)੭

사실 <아누아>라는 브랜드에 본격적인 관심을 갖게 된 건 PDRN라인의 모델 현재 덕이에요🩵 청순ෆ청량ෆ청초 이미지랑 아누아의 이미지랑 착붙이어서 호기심이 들었구, 그 덕분에 아누아의 좋은 기초 제품들을 여럿 알아갈 수 있었어요☺️ [현재 칭찬해 🙌] [아누아 칭찬해 🙌] 
몇 달 전에 올리브영 온라인몰에서 아누아 pdrn 라인의 글로우 패드와 세럼 마스크를 구입해서 직접 써봤을 때, 두 제품 모두 다 데일리로 쓰기 적합해서 그런지 이미 아누아 PDRN 라인에 대한 신뢰도가 꽤 높아져버렸답니다🫰 기대감 업된 디폴트인 상태에서 새롭게 pdrn라인의 수분래핑크림도 더해 사용해보려고 하니까 뭔가 더 두근두근하는 것 같더라구요💗💗💗

특히 이번에 구매한 수분크림 2매입 세트는 가성비가 좋아서 낭낭하게 쟁여두기에 아주 딱😉-이더라구요! 보관하기에도 좋은 튜브형이라 위생적인데다가 용량도 넉넉하게 담겨 있어서 아침저녁으로 팍팍 짜 써도 오래 쓸 수 있을 것만 같아요😚 <데일리로 찔끔씩 아껴 써야하는 제품은 솔직히 좀 그렇잖아요ㅎ데일린데ㅎㅎ

제형은 묽은 젤 크림?같은데 바르면 싸악- 빠르게 흡수되는데다가 끈적임이 1도 없어 꽤나 산뜻하게 느껴지더라구요🌿 피부의 속보습을 확실하게 채워줘서 수분 부족인 제 피부에도 딱 맞고🫶 세안 후에 당김이 줄어, 아침에 메이크업 전에 발라도 전혀 밀림감이 안 느껴져서 데일리 크림으로 정말 강추 강추 왕왕강추 드리고 싶숩니다👍

글고 기초템 방랑자들은 특히 공감하실 것 같은데😅 이런 짱짱한 데일리 기초 화장품을 꾸준히 쓰면 피부도 편안해지고 점점 다가오는 가을 환절기 각질 들뜸이 확 줄어, 피부결이 부드러워질 수 있잖아요 저는 이번 가을 건조함에 대응할 수 있는 기초를 찾은 것 같아요😊 특히 아누아 pdrn 라인 제품들 특성상 무향에 가까워 냄새에 민감한 제가 느끼기에도 전혀 부담 없이! 밤에 양껏 도포하고 자고 일어나면 아침에 피부가 촉촉하고 편안해지는 것 같아요 으하하

그치만 굳이굳이 아쉬울 법한 점을 꼽자면…🤔 극건성 분들이 한겨울에 단독으로만 쓰긴 조금 가볍게 느낄 수 있지 않을까 하는 생각이 들어요..하지만 수분부족 지성·복합성 피부는 사계절 내내 잘 쓸 수 있을 것 같고, 극건성분들도 다른 기초 제품을 보강해주신다면 데일리로 쓰기 무난할 것 같아요! 

현재를 모델로 촬영한 아누아의 뷰티쁠 화보 덕분에 알게 된 브랜드인데 점점 제가 믿고 꾸준히 쓸 수 있는 브랜드로 자리 잡았네요😆 앞으로도 기회 될 때마다 꼭 쟁여놓을 예정이고 재구매 의사 완전 완전 있어요
        
        
              
                ... 더 보기"
5,2025.09.02,,,,FALSE,"지금까지 썼던 수분크림은 촉촉하긴 해도 기름진 감이
심해서 수부지인 저에게는 아쉬웠는데 아누아 pdrn 수분크림은 부드럽게 잘 발리고 기름지지 않게 수분만 꽉 채워준다고 느껴서 좋았어요!! 적당히 꾸덕하게 수분 채워주는 수분크림으로 제격인 것 같습니다 아누아 최고😻😻"
5,2025.08.30,민감성,쿨톤,,FALSE,"수부지 피부라 크림을 고르는 게 매번 고민이었는데 아누아 PDRN크림은 제형이 젤크림같은 제형이라 가볍고 발림성도 너무 만족스럽습니다😻 피부에 가볍게 스며들고 겉돌지 않으면서 속보습까지 채워주는 느낌? 사실 최애가 모델이라 구매했던건데 제 피부에 너무 잘 맞는 크림을 발견해서 너무 만족스러웠습니다..👍 바르고 나면 광채가 도는데 끈적임이 없어서 신기했어요🙊 바로 메이크업 해도 밀리거나 들뜸 없어서 너무 너무 만족합니다😻😻 
특히 속당김이 심한편인데 이 크림은 속보습을 너무 잘 잡아줘서 속당김 없이 편안하게 유지되는 게 진짜 좋아요..👍
저처럼 수부지라 크림 고르기가 힘들었던 분들, 혹은 지성인데도 속당김 때문에 보습이 필요한 분들에게 추천드립니다..🫶🏻 무겁지 않으면서도 촉촉한 크림이라 계절 구분 없이 데일리 크림으로 잘 쓸 수 있을 것 같아요. 아누아 최고...🩵"
5,2025.08.12,복합성,여름쿨톤,"잡티, 미백",FALSE,"아누아 피디알엔 히알루론산 100 세럼을 사용하다 수분크림을 같이 구매를 해보았어요 !

평소 세럼을 자주쓰다보니 크림을 별로 선호하지않는데

세럼보다 더 가벼운 느낌이라 더 가볍게 사용할수있고

묽은타입은 아닌 흐르지않는 꾸덕재질이며
보습은 제가사용해본 보습라인중에 최고에요 
발림성은 정말 부드럽고
지속력도 좀 있는거 같고
사용후 끈적임은 다소있지만 불편할정도는 아니에요!

또 입구가 사진처럼되어있어 양조절이 용의해서 매우 마음에 들었어요 !

세럼과 함께 잘 사용해서 한달후기 알려드릴게용 !
        
        
              
                ... 더 보기"
5,2025.07.29,복합성,봄웜톤,"블랙헤드, 모공",FALSE,엠플 사면서 같이 사봤는데 넘 맘에 들어요!! 자극적인 냄새도 안 나고 수분감 잇는 크림을 좋아해서 에스네이처 크림 쓰다가 이번에 바꿔봤는데 만족스럽습니다!! 엄청 무겁게 올라가지도 않고 바르고 화장해도 밀리는 느낌도 없고 넘 만족해용!
5,2025.06.03,복합성,쿨톤,"미백, 주름",FALSE,히알루론산으로 유명한 타제품들대비 후발주자같지만 좋은성분으로 승부하는 브랜드라고 생각됩니다. 이번에 이 수분크림 기격이 괜찮다고 생각돼서 써보고싶었어요. 촉촉하게 끈적임없는 제형이 마음에 들고 수분충전도 잘 해주는 느낌입니다. 기본60ml용량도 많은편인데 20ml 휴대용까지 포함이라 여행 시 가지고다니기도 좋겠네요.
